"Time","title","Field3"
"2018-11-18 08:30","油を使わない、超淡麗なシジミスープにうっとり! 福島・喜多方「塩川屋」","福島県喜多方市の「農家レストラン 塩川屋」は、11年に定食店として創業、14年にラーメン主体に変更した。〈■情報は発売中の「ラーメンWalker福島2019」より〉"
"2018-11-18 05:05","年収500万の男でも、これがあれば勝つ!最初は女から相手にされていなくても、挽回できる必勝テク","恋とは、どうしてこうも難しいのだろうか。せっかく素敵な出会いをしても、相手に「また会いたい」と思わせない限り、デートにも交際にも発展しない。仮に、順調に駒を進められても、ある日突然別れを突き付けられる..."
"2018-11-18 05:04","“自分は特別”と錯覚してしまった女の悲劇。一度味わってしまった高揚感に、狂わされた人生","深窓の令嬢が、超リッチな男と結婚。それは社会の上澄みと呼ばれる彼らの、ありふれた結婚物語。有馬紅子(ありま・べにこ)もそんな物語の一人として17年間幸せに暮らしてきた。しかし突然、夫・貴秋が若い女と駆..."
"2018-11-18 05:03","「あなたはもう、庶民じゃないでしょ?」結婚してセレブ妻の仲間入りした女の心をエグる、ママ友の一言","あなたが港区界隈に住んでいるならば、きっと目にしたことがあるだろう。透き通るような肌、絶妙にまとめられた巻き髪。エレガントな紺ワンピースに、華奢なハイヒール。まるで聖母のように微笑んで、幼稚園児の手を..."
"2018-11-18 05:02","みんなで集まるならこんな鍋が盛り上がる!見た目のインパクト抜群な人気もつ鍋4選","この時期になると、鍋は食べる機会も多くて、ベタな鍋ではちょっと食べ飽きてしまうこともあるのではないだろうか?そんなマンネリ化したタイミングにもってこいなのが、見た目のインパクト抜群なもつ鍋である!見た..."
"2018-11-18 05:01","まるでケーキのような食べ応えの「レアチーズサンド」!新宿で手土産なら、この新店","今年も、残すところひと月半。何かと人と集まる場面が多い、楽しい季節がやってきた!一方で、手土産に困る時もあるのでは?そんな手土産難民に朗報だ!手土産・テイクアウト専用のチーズスイーツ店『now on ..."
"2018-11-18 05:00","このバッグで、イルミネーションを歩きたい!ブルガリのホリデーコレクションをご紹介","街を歩けば、キラキラと輝くデコレーションに、ホリデーシーズンの到来を感じる季節。この時期は、身につけるだけで気分が上がる、スペシャルなファッションアイテムが欲しくなる!今季ブルガリから届いたのは、まさ..."
"2018-11-17 17:30","“チーズ餃子”が旨い東海エリアの店3選!肉汁あふれる餃子に絡む、こんがりチーズがたまらない!!","中華料理店で餃子&ビールもいいけれど、イマドキ餃子はおしゃれに楽しむのがトレンド。なかでも女子人気の高い“チーズ”を使った餃子が増加中だ。個性あふれるメニューのなかから、自分好みのチーズ餃子を探してみよう!!"
"2018-11-17 15:00","国産米粉から作ったサクッと食感のデニッシュが自慢!「米粉パン Le・Riz」","「米粉のおいしさをもっと広めたい」と、夫婦で営む米粉パン Le・Riz。季節の食材がのったデニッシュをはじめ、食パンやサンドイッチ、ハード系パンなど種類も豊富にそろう。＜※情報は関西ウォーカー(2018年11月6日発売号)より＞"
"2018-11-17 12:00","【忘年会/幹事さん必見】福岡の個室有、大人数OK、鍋料理……編集部オススメのお店4選","さあ、忘年会シーズンスタート。「どこのお店がいいんだろう……」と迷っている幹事さんも多いのでは? そこで今回は福岡エリアにある個室有や大人数OK、鍋料理のお店などを編集部がピックアップ! いつもとは雰囲気が違うお店をチョイスすれば、上司や友達から”できるヤツ”として一目置かれるかも?"
"2018-11-17 12:00","いきなり新店2位!シャモロックの旨味が際立つ埼玉の「麺処 若武者 草加分店 東北六縣堂」","総合部門だけでなく新店部門も多くのラーメンファンに注目される「ラーメンWalkerグランプリ」。中でも激戦区・埼玉の順位はファンならずとも気になるところだろう。今回は百麺人も絶賛する、新店2位の店を紹介する。"
"2018-11-17 12:00","仙台のパンク好き店主による、まさに”ハンパない”一杯!「ラーメンスミス」","宮城でも人気の高い煮干しラーメン。今回は量の煮干しと味噌の、個性派ラーメンを作り出す話題の店を紹介する。"
"2018-11-17 12:00","長岡のソウルフードのパイオニアが総合2位に!「青島食堂 宮内駅前店」","その結果にラーメン業界が毎年注目する「ラーメンWalkerグランプリ」。先日発表された新潟の2018年のランキングも大いに注目された。その中から、総合部門第2位に輝いた長岡の名店を紹介する。"
"2018-11-17 11:00","【祝・体験者100万人突破】SVB東京が開業後初のリニューアル!1日1組限定コースも新設","スプリングバレーブルワリーが累計体験者数100万人を突破! これを記念して、代官山にあるスプリングバレーブルワリー東京(以下、SVB東京)が開業後初めてリニューアルしました。(スプリングバレーブルワリ..."
"2018-11-17 11:00","土日祝OK!休日のランチに!福岡・薬院エリアおすすめランチ4選","「いつもと違うランチが食べたい!」「今日のお昼、どうしよう」。そんなランチのお悩みをズバッと解決。土日祝も営業しているお店やごちそうランチ、コストパフォーマンスが高いランチを編集部がセレクトした。パスタ、ご飯&魚、ピザ、クスクスと、バラエティに富む福岡・薬院エリアのランチ4つを紹介する。"
"2018-11-17 07:55","福島のラーメン殿堂店「とら食堂」 白河手打ち中華の総本山で、品格に満ちた究極の一杯を","ラーメンWalkerが主催するラーメンWalkerグランプリ福島で、2年連続1位となり3年前に殿堂入りしたのが、白河市の「とら食堂」だ。〈■情報は発売中の「ラーメンWalker福島2019」より〉"
"2018-11-17 05:04","略奪愛:「好きになってしまいそう...」彼氏のいる女が本能で惹かれた、年上男の魅力とは","人のものを奪ってはいけない。誰かを傷つけてはいけない。そんなことは、もちろんわかっている。しかし惹かれ合ってしまったら、愛してしまったら、もう後戻りなんてできない-。三好明日香(みよし・あすか)は渋谷..."
"2018-11-17 05:03","どうして僕が?友達にしか見られていなかった年収500万の男が、美女と交際できた理由とは","私たちはこれまでに散々、LINEやデートのHow toを学んできた。しかし、やっとの思いでLINEやデートに漕ぎ着けても、失敗の可能性は常につきまとうのだ。あんなに盛り上がったはずなのに、突然の既読ス..."
"2018-11-17 05:02","中流家庭に転落した実家。“白金のお姫様”になるはずだった女のプライド","先祖代々受け継がれし名声と財産。それを守り続けるために、幼い頃から心身に叩き込まれる躾と品位。名家の系譜を汲む彼らは、新興のビジネスで財を成した富裕層と差別化されてこう呼ばれる。「オールドリッチ」と。..."
"2018-11-17 05:01","焼き鳥は串だけじゃない!焼肉スタイルでわいわい楽しい人気店はここだ!","焼き鳥を食べるなら串と決めつけてはいないだろうか?そんな人にはぜひ鶏肉を焼き肉スタイルで楽しめる『焼肉鳥 gg』を訪れてみて欲しい!メニューや味変できる調味料も豊富で、みんなでワイワイ盛り上がれる店な..."
"2018-11-17 05:00","本日オープン!世界一の幸福感が味わえると噂の、「フレンチトースト」専門店!","1週間頑張った休日は、ゆっくりと朝の時間を過ごしたいもの。そこに美味しい朝食があれば、さらにテンションが上がること間違いなし。今回ご紹介するのは、本日11/17(土)オープンの新店。“世界一の幸福感”..."
"2018-11-16 21:30","ワイン×餃子がトレンド!女子1人でも行けちゃう名古屋の“おしゃれで旨い餃子”店3選","中華料理店で餃子&ビールもいいけれど、イマドキ餃子はおしゃれに楽しむのがトレンド。ワインやシャンパンと共に、女子1人でも気軽に行けちゃうバル風の空間で餃子を堪能しよう!"
"2018-11-16 21:18","まろやかな泡で人気確実!?東海エリアで行くべき“泡系”ラーメン店3選","スプーマとはスペイン語で泡の意。世界最高峰のレストラン「エル・ブジ」のシェフが亜酸化窒素で液体をムース状にする調理法、エスプーマを考案し、注目を集めるようになった。このアイデアがラーメンにも取り入れられ、16年ごろから関西で泡系がブレイク。泡立てることでスープの脂分と水分が一体化し、味がまろやかに。麺にもよく絡むなど、いいこと尽くしだ。"
"2018-11-16 20:41","うまくてボリューミーで、安い!地元民が足しげく通う愛され”町の中華屋さん”6選 in 名古屋","地元民が足しげく通う町の中華料理屋さん、略して“町中華”。安くて、おいしくて、ボリュームたっぷりが魅力の、長年愛されてきた名古屋の町中華店を紹介する!"
"2018-11-16 18:00","昔懐かしいラーメンを味わい深い店内で。東海3県の“ノス系”ラーメン4選","安い値段でおなかいっぱいになってほしいと、なみなみと盛られたラーメンや、うどんやそばと同じダシで作るラーメン。どれもしみじみと味わい深く、遠出してでも食べる価値がある。昭和の雰囲気あふれる店内で、ノスタルジックな味を楽しめる東海3県の老舗4店をご紹介!"
"2018-11-16 17:30","ブームの兆しあり!“クリームを味わう”スイーツにコンビニ各社が熱視線","かつては引き立て役として考えられることが多かったクリーム。だが、ここ最近はクリームを主役に据えたスイーツも増えてきた。"
"2018-11-16 17:23","横浜・元町のオーガニック定食でデトックス!体にやさしい安心デリカフェ","横浜・元町といえば洋の文化が根付く街。ゆえに、食事処といえば洋食の店がほとんど。それはそれで、もちろん楽しみたいが、たまにはバランスの取れた食事や、体にやさしいものを食べたい。そんなときに重宝するのが「きせきの食卓」だ。"
"2018-11-16 13:00","ランプ×イチボの肉寿司で赤みの旨さを堪能!「京都ステーキ  南大門 錦店」","1957年(昭和32)年創業の焼肉店「南大門」が錦市場の路地奥に「京都ステーキ 南大門 錦店」をオープン。京丹波産の黒毛和牛「平井牛」のA5ランクのみを使用し、ステーキや丼、肉寿司などを定食スタイルで手ごろにそろえる。＜※情報は関西ウォーカー(2018年11月6日発売号より)＞"
"2018-11-16 12:20","「高級食パン」ブームが全国に! きっかけは“4ヶ月で1500万個”も売れたコンビニ商品だった","J-WAVEで放送中の番組『STEP ONE』(ナビゲーター:サッシャ・寺岡歩美)のワンコーナー「BEHIND THE SCENE」。11月15日(木)のオンエアでは、高級食パン戦争について徹底取材を..."
"2018-11-16 12:08","うまみが口に蓄積される、モチモチの「担々麺」を新宿御苑前で!","J-WAVEで放送中の番組『STEP ONE』(ナビゲーター:サッシャ・寺岡歩美)のワンコーナー「7-ELEVEN LUNCH HUNTER」。この週は、ゲスの極み乙女、 DADARAYのベーシスト、..."
"2018-11-16 12:00","タイトル変更:あの「にしきや」発レモンペッパー味のチキンカレー!味も見た目もおしゃれすぎ!","今回ご紹介するレトルトカレーはこちら!どん! ごちそうレトルトブランド・『にしきや』の『レモンペッパーチキンカレー』です!見てください!このインスタ映え間違いなしな可愛いパッケージ。■レモン×ペッパー..."
"2018-11-16 12:00","昼限定!埼玉新店3位に輝いたオール自家製&手作りの一杯「らあめん吟」","先日2018年版が発表された「ラーメンWalkerグランプリ」。その中でも新店部門は毎年多くのラーメン好きが注目するランキング。今回は全国でも屈指の激戦区・埼玉で3位に輝いた、昼営業限定の店を紹介する。"
"2018-11-16 12:00","前菜からメイン、ドルチェまで本格的なイタリア気分が味わえる「Localeria PiCoLoRe」","イタリア各地の郷土料理と、新鋭のヘルシーフード“ピンサ”を味わえるイタリアン。シチリアや名ピッツェリアで経験を積んだシェフ2人が作るメニューに加え、イタリア産ワインやビールも豊富にそろう。＜※情報は関西ウォーカー(2018年11月6日発売号)より＞"
"2018-11-16 11:00","日本の焼き鳥専門店に潜入!韓国人リポーターがビックリしたのはあのメニュー","韓国からの留学生が日本にきてビックリしたこと。それは……焼き鳥の種類が多い!"
"2018-11-16 09:00","本格中華を油控えめでヘルシーに!地元食材にもこだわった「神戸中華 うえばやし」","「神戸中華 うえばやし」は、三宮の人気中華料理店チャイナ食堂 九龍を支えてきた料理人が独立オープン。独自のアレンジで、地元食材にこだわった中華を提供する。料理と合わせて、常時10種以上そろう中国酒や中国茶もぜひ。＜※情報は関西ウォーカー(2018年11月6日発売号より)＞"
"2018-11-16 07:46","シロノワール小枝とキスしよう。","今年も寒い冬が到来しました。そうですよね、“キス”したいですよね?あなたの心にそっと寄り添う。ライターのオソサキカイです。皆さん最近キスしていますか?女性誌ananでも幾度となく特集の組まれて来た「キ..."
"2018-11-16 07:45","甘辛さが絶妙な“辛味噌”にハマる! 山形名物の赤湯ラーメンを福島で「六文銭」","18年3月にオープンした、福島市の「赤湯辛みそ中華そば 六文銭」。山形県でラーメンの街として知られる、赤湯の辛味噌ラーメンが福島で食べられる。〈■情報は発売中の「ラーメンWalker福島2019」より〉"
"2018-11-16 05:06","女から異常な執着をされ、壊れてしまった男。妻は決して知らぬ、“被害者”だったはずの夫が語る真実","突如僕の人生に現れた黒髪の美女・ひとみ。僕はその美貌と清楚な雰囲気に夢中になったけれど、実態は異常な女だった。ひとみによって巻き起こされるトラブルを解決してくれた、昔からの女友達・雅子と結婚したのにも..."
"2018-11-16 05:04","親友の妊娠を、祝ってあげられない…。望んでいた未来を手にすることが出来なかった女の悲痛な叫び","「結婚なんかしない」そう、言い張っていた。今の生活を手放すなんて考えられない。自由で気まぐれな独身貴族、それでいいと思っていた。仕事が何より大事だと自分に言い聞かせ、次々にキャリア戦線を離脱してゆく女..."
"2018-11-16 05:03","先祖代々受け継ぐ財産に、苦しめられる者の現実。「オールドリッチの悲哀」全話総集編","先祖代々受け継がれし名声と財産。それを守り続けるために、幼い頃から心身に叩き込まれる躾と品位。名家の系譜を汲む彼らは、新興のビジネスで財を成した富裕層と差別化されてこう呼ばれる。「オールドリッチ」と。..."
"2018-11-18 11:00","いかを使ったおつまみレシピ","おつまみに欠かせない具材の一つ『いか』。でもいつもとは違う食べ方をしたい!というときもあるのではないでしょうか。日々ビールに合うおつまみを提案する「ビール女子Kitchen」から、今夜は『いか』を使っ..."
