"Time","title","Field3"
"2018-11-05 05:00","先週のアクセスランキング!1位は「お金も、夫も、美貌も、すべてを失った女。一通のメールで知らされた“最愛の男”からの報告とは」","「東京カレンダーWEB」の1週間分のランキングから、人気記事ベスト5をご紹介!“一通のメールで知らされた“最愛の男”からの報告”に“信頼していた男の態度が180度豹変した日”から“プライド高きボス妻が..."
"2018-11-04 16:00","【インタビュー】多様性を体現する生き方!「ガール・ギャング」を結成するポートランドの女子ブルワー","ビール女子のみなさま、こんにちは!ポートランド在住の東リカです。ポートランドの女子ブルワーをリレー形式で紹介するこの企画。3人目は、前回のジェンさんが「とってもクリエイティブ!尊敬する!」とご紹介下さ..."
"2018-11-04 12:00","「辻調」が熊本を食で応援!「どーんとレンコンビーフカレー」を食べてみた!","関西で有名な『辻学園調理・製菓専門学校』。“辻調”の愛称で親しまれていますよね。(※ 以下、辻学園)今回は、その辻学園が熊本の震災復興のためにつくったレトルトカレー『熊本あか牛 どーんとレンコンビーフ..."
"2018-11-04 12:00","福岡に来たら食すべき! 黄金色の贅沢スープで炊いた“新・水炊き”に感動!","「おいしい水炊きが食べたいんだけど、どこかオススメを教えて!」と、来福する知人や友人によく聞かれる。いくつかお気に入りの候補のひとつが「とり田」。水炊きのおいしさを十分堪能できるうえ、雰囲気はオシャレで、ワインなどのお酒も充実しているから、舌の肥えた人たちは、迷わずここへ連れて行く。"
"2018-11-04 11:30","自慢の一杯を味わう!長崎郊外のおすすめ個性派ラーメン8選","絶対に食べておきたい長崎県郊外の人気個性派ラーメンをご紹介。自分好みの最高の一杯を求めて、ラーメン巡りを楽しもう!"
"2018-11-04 11:10","あの「とら食堂」で学んだ亡き父の味を真摯に継ぎ、進化を目指す白河ラーメン","福島県郡山市の人気ラーメン店「手打中華そば 麺屋 正遊」。初代は現店主の父親で、白河ラーメンの元祖「とら食堂」の愛弟子だったが、15年に急逝。亡き父の店を引き継ぎ、先代の味をベースにさらなる進化を目指す。〈※情報は18年10/25発売の「ラーメンWalker福島2019」より〉"
"2018-11-04 05:04","「まさかあの人が、あなたの夫?」格下妻が、一夜で女たちの嫉妬羨望の的となった理由","あなたが港区界隈に住んでいるならば、きっと目にしたことがあるだろう。透き通るような肌、絶妙にまとめられた巻き髪。エレガントな紺ワンピースに、華奢なハイヒール。まるで聖母のように微笑んで、幼稚園児の手を..."
"2018-11-04 05:03","弱ったフリして、憧れの人を部屋に連れ込んだ女。2人の男を翻弄する、危険な計画","深窓の令嬢が、超リッチな男と結婚。それは社会の上澄みと呼ばれる彼らの、ありふれた結婚物語。有馬紅子(ありま・べにこ)もそんな物語の一人として17年間幸せに暮らしてきた。しかし突然、夫・貴秋が若い女と駆..."
"2018-11-04 05:02","そのLINEと電話、ちょっと待った!女が思う「マメな男」と「ウザい男」の境界線とは","恋とは、どうしてこうも難しいのだろうか。せっかく素敵な出会いをしても、相手に「また会いたい」と思わせない限り、デートにも交際にも発展しない。仮に、順調に駒を進められても、ある日突然別れを突き付けられる..."
"2018-11-04 05:01","カリカリを越えた極薄皮の焼き餃子がすごい!高知名物の絶品餃子でわいわい飲もう!","餃子の命はなんと言ってもこんがりと焼き上げられたカリカリとした皮の食感だ!それが、極薄のクリスピーな皮によって、もはやカリカリをも越えている新食感の店を発見!そんな最高の美味しさを楽しめる名店を紹介し..."
"2018-11-04 05:00","初購入でも“わかってる感”のあるクルマを!200万円前後でオススメなコンパクトカー5選","クルマ離れが叫ばれるこの時代に、カーライフの楽しさを知ってもらわんとするこの企画!自動車を得意とするベテランライター・サトータケシが、クルマ担当の編集部員船山に、わかりやすくクルマの魅力を解説する!今..."
"2018-11-03 18:00","自慢の一杯を味わう!長崎郊外のおすすめ豚骨ラーメン5選","絶対に食べておきたい長崎県郊外の人気豚骨ラーメンをご紹介。自分好みの最高の一杯を求めて、ラーメン巡りを楽しもう!"
"2018-11-03 17:00","九州の旬の素材を使った”和食”を心ゆくまで堪能できる福岡で注目の3軒","国土が南北に細長く、四季がはっきりと分かれている日本では、季節によってさまざまな食材の旬を楽しんできた。そして、豊かな自然を崇拝する日本人の気質を反映し、多くの習わしとともに育まれてきた日本の食文化は、2013年、ユネスコ無形文化遺産に登録。インバウンド需要もあって、”和食”は、ますます注目されている。せっかく日本に住んでいるのだから、その真髄に触れないなんて、もったいない!"
"2018-11-03 12:00","なんだこれ…ニオイも味も初めての邂逅「天草産たこカレー」","突然ですが、あなたは″たこカレー”を食べたことはありますか?たことカレーなんて変わったコラボレーションにも思えますが、世の中に『うなぎの肝カレー』や『○◎カレー』があることを考えると、そんな突飛な組み..."
"2018-11-03 12:00","福岡で愉しむ、日本料理を牽引し続ける老舗の味","1830年に大阪で創業した、日本を代表する老舗料亭の「なだ万」。デパ地下などの惣菜売り場でもお馴染みだが、実際に店舗を訪れたことのある人は、どのくらいいるだろうか。関西圏では複数展開するが、九州エリアでは、福岡に1店舗あるのみ。キャナルシティ博多にあるホテル「グランドハイアット福岡」に店を構えている。"
"2018-11-03 11:30","ランチにも〆にもおすすめ!福岡・中洲で行くべき“うどん店”5選","福岡は多彩なルーツや個性がきらめきを放つ“うどん先進都市”。一度食べたらやみつきになる、中洲エリアのおすすめうどん店を紹介する。日々進化する福岡うどんをご堪能あれ!"
"2018-11-03 10:00","芳醇極まる鶏塩や、福島鶏白湯は不朽の一杯! 福島・二本松のラーメン殿堂店「若武者」","福島県二本松市の「麺処 若武者」は、福島の若手ラーメン界を牽引する山本一平店主が手がける店。ラーメンWalkerが主催する「ラーメンWalkerグランプリ」で福島総合2年連続1位となり、2015年に殿堂入りした店だ。〈※情報は発売中の「ラーメンWalker福島2019」より〉"
"2018-11-03 05:05","「マメな男はモテる」は真実か?毎晩連絡を取っていたのに、2回目のデートで女が冷たくなった理由","私たちはこれまでに散々、LINEやデートのHow toを学んできた。しかし、やっとの思いでLINEやデートに漕ぎ着けても、失敗の可能性は常につきまとうのだ。あんなに盛り上がったはずなのに、突然の既読ス..."
"2018-11-03 05:04","「金目当ての女」を襲う、因果応報。婚約者のドス黒い腹の内を知った女の、複雑な心情","先祖代々受け継がれし名声と財産。それを守り続けるために、幼い頃から心身に叩き込まれる躾と品位。名家の系譜を汲む彼らは、新興のビジネスで財を成した富裕層と差別化されてこう呼ばれる。「オールドリッチ」と。..."
"2018-11-03 05:02","とにかくご飯が旨い店はここ!!中目黒の救世主的な「めしや」で新米おかわり!","お米が美味しい季節・秋。この時期にこそ訪れたいのが中目黒にある人気店『めしと汁 といろ』だ。多数のおばんざいを揃え、自分好みの定食や晩酌セットを作れる同店の魅力を紹介しよう!一軒家を利用して作られた店..."
"2018-11-03 05:01","キマった時のエレガントさが尋常じゃない!大人が着るロングスカートの極意","すらりと脚が長くみえるスタイリングがあるならば、もちろん取り入れてみたいもの。でも、普段馴染みが無いだけで難易度が高いと決めつけて、手が出せないアイテムがある。女性にとっては、くるぶしまであるロングス..."
"2018-11-02 21:00","炙り真鯛に貝系、寿司職人が作るラーメンetc.いま東海で注目の鮮魚系ラーメンって?","昆布や煮干しといった乾物素材ではなく、鯛のアラの部分や貝類など生の魚介を使用した鮮魚系スープ。臭みや雑味が出ないように丹念に仕込むことで、優しい香りでありながら、凝縮された旨味を存分に味わえるとファンが増加中だ。日本料理にも通じる、繊細さと奥深さが魅力の鮮魚系ラーメン。東海エリアの名店をピックアップして紹介する!"
"2018-11-02 19:58","フルーツの旨味が際だつ!高級フルーツをたっぷり使った人気パーラー","東京・目黒で30年以上続くフルーツパーラーが2018年7月10日、ランドマークプラザに登場。要となるフルーツは、毎朝店主が市場に出向き、熟した一番状態のいい高級フルーツを厳選。注文が入ってからカットするこだわりぶりだ。パフェ、サンドイッチ、ドリンク、パンケーキ、ズコットなど、どのメニューにもフルーツをふんだんに使っていて、コスパは抜群!さらにアイスクリームも生クリーム特注で、フルーツの旨味を楽しんでほしいと使用するメニューにより味を変えている。"
"2018-11-02 18:30","自慢の一杯を味わう!熊本のおすすめ個性派ラーメン7選","絶対に食べておきたい熊本の人気個性派ラーメンをご紹介。自分好みの最高の一杯を求めて、ラーメン巡りを楽しもう!"
"2018-11-02 18:00","自慢の一杯を味わう!大分郊外のおすすめ個性派ラーメン5選","絶対に食べておきたい大分県郊外の人気個性派ラーメンをご紹介。自分好みの最高の一杯を求めて、ラーメン巡りを楽しもう!"
"2018-11-02 17:00","個性豊かな麺ぞろい!うどんの聖地・福岡でおすすめのうどん酒場9選","うどん発祥の地・博多区の「承天寺」周辺は、個性が際立つうどん酒場の激戦区。博多、讃岐、胚芽麺など、各店の違いを楽しみながら巡ってみよう。"
"2018-11-02 17:00","「ラーメンWalkerグランプリ2018」神奈川の新店ベスト3発表!","ラーメン情報誌「ラーメンWalker」(KADOKAWA)が行っている、旨いラーメン店を決めるランキング「ラーメンWalkerグランプリ」。「神奈川総合」と2017年12月31日までにオープンした店舗を対象にした「神奈川新店」の2部門で、読者と百麺人の投票によって選ばれた全国屈指の”旨い店”を大発表!今回はそのなかから、神奈川新店ベスト3を紹介。＜情報は「ラーメンWalker神奈川2019」(2018年10月5日発売)より＞"
"2018-11-02 12:05","おいしくて彩りもバッチリ!話題のカラフルメニューがあるカフェ3選","色が変わるドリンクやカラフル餅など、かわいくておいしい一品が集合!写真映えもバッチリなカラフルメニューがあるカフェをご紹介!＜※情報は関西ウォーカー(2018年10月23日発売号)より＞"
"2018-11-02 12:05","メニューも店内も撮りたくなる!フォトスポットいっぱいのかわいいカフェ3選","ピーナッツの仲間たちが迎えてくれるカフェなど、メニューも店内もかわいい、写真を撮りたくなるスポットが続々。そんなフォトスポットのあるカフェ3店をご紹介!＜※情報は関西ウォーカー(2018年10月23日発売号)より＞"
"2018-11-02 12:00","「チキン」に隠された別の意味とは…!? 「あべどりチキンカレー」で解き明かす!","皆さんはご存知でしょうか。「アメリカやカナダといった北米圏で、鶏のイラストが入った服を着ていると、ゲラゲラ笑われる」ということを。■よみがえる、中学生時代の苦い思い出。 あれは筆者が中学2年生のときで..."
"2018-11-02 12:00","とろ～り感がたまらない!ラクレットがおいしい神奈川の店3選","11月11日はチーズの日。肌寒くなってくると食べたくなる、とろ～りアツアツの「チーズ」! とろとろのラクレットやチーズフォンデュなど、近ごろチーズが主役の料理がブームを呼んでいる。専用オーブンで溶かしたラクレットチーズをジャガイモなどにつけて味わうスイス料理、ラクレット。神奈川でラクレットを味わえる3店を紹介しよう。"
"2018-11-02 12:00","ランチにも〆にもおすすめ!福岡・博多区で行くべき“うどん店”5選","福岡は多彩なルーツや個性がきらめきを放つ“うどん先進都市”。一度食べたらやみつきになる、福岡市博多区のおすすめうどん店を紹介する。日々進化する福岡うどんをご堪能あれ!"
"2018-11-02 11:00","ヤゲン軟骨のスパイス揚げ","オシャレなビール女子達は『ヤゲン軟骨』を食べたことある?焼き鳥屋さんで見かける串焼きがあるけど、今回は『スパイス』の風味を効かせてから揚げに。カリコリッっとした食感とスパイスでビールが止まらなくなっち..."
"2018-11-02 11:00","いざ、歓喜のマシマシ! 千葉・渋谷の大行列G系「ちばから」3店目は福島県郡山市に","「ちばから 郡山店」が18年7月、福島県郡山市にオープンした。千葉県市原市から全国展開を目指すG系(ガッツリ系)の超人気店が、東京・渋谷道玄坂店に次いで進出したのが郡山となる。〈※情報は発売中の「ラーメンWalker福島2019」より〉"
"2018-11-02 08:00","スイーツを食べて美しくなる!?サーウィンストンホテル(八事)の“美”にこだわった冬季限定スイーツを堪能しよう!!","「サーウィンストンホテル」(名古屋市昭和区)のレストラン「オールデイ・ラウンジ&バー『STRINGS LOUNGE』」で“食べて美しくなる!“をテーマにした「ウィンター&クリスマス アフタヌーンティー」がスタートする。期間は、2018年11月13日(火)から12月30日(日)まで。"
"2018-11-02 05:03","ジワジワと、社会から切り離されていく。キャリアを捨てきれぬ妊娠3ヶ月の女を襲った、突然の悲劇","「結婚なんかしない」そう、言い張っていた。今の生活を手放すなんて考えられない。自由で気まぐれな独身貴族、それでいいと思っていた。仕事が何より大事だと自分に言い聞かせ、次々にキャリア戦線を離脱してゆく女..."
"2018-11-02 05:02","もう二度と、愛する男に会わせてもらえない。ストーカーの烙印を押されてしまった女の、成れの果て","突如僕の人生に現れた黒髪の美女・ひとみ。僕はその美貌と清楚な雰囲気に夢中になったけれど、実態は異常な女だった。ひとみによって巻き起こされるトラブルを解決してくれた、昔からの女友達・雅子と結婚したのにも..."
"2018-11-02 05:01","骨抜きサンマが絶品すぎる!技は超一流で居心地抜群の銀座の名店はここ!","サンマが美味しく味わえる季節ももうすぐ終わり。最後に絶品のサンマを食べて今秋を締めくくりたいとお考えならば銀座の名店『矢部』を訪れて欲しい。骨を抜いてワタを綺麗にして戻して焼くことで、食べる際に骨をわ..."
"2018-11-02 05:00","後輩と2人飯なら、白金の有名店が正解。粋なカウンター和食は、上司の貫禄が滲み出る","かつて、自分が若手だった頃。遊び方や飲み方はすべて先輩が教えてくれた。六本木や西麻布の艶やかさが日常になったとき、連れていかれた白金の桁違いの大人感に圧倒されたのを覚えている。そう、後輩を一つ上の世界..."
"2018-11-01 20:41","冬は、寿がきやのみそ煮込うどん!豪華景品や限定商品がゲットできる(!?)イベント&キャンペーンが開催!!","寿がきやの「みそ煮込」(124円)は、店に行かなくても本格的な味が楽しめると、東海地区を中心に人気の商品だ。これからの季節にもぴったりなみそ煮込みうどんを、もっと楽しむためのイベント&キャンペーンを紹介する!"
"2018-11-01 20:18","＜全7店舖＞今だけ味わえるごちそう!東海の人気&実力派ラーメン店の絶品ユニーク麺!!","愛知・岐阜・三重のラーメン店主が集い、東海の旨いラーメンを発信している「東海麺友会」が結成10周年をむかえた。これを記念して、東海の人気ラーメンも含めて期間限定コラボ麺が販売される。今回はそのなかでも、ちょっとユニークな限定ラーメンを7つ紹介しよう!"
"2018-11-01 20:10","シビれる辛さがクセになる!東海3県の“シビ辛麺”6選","シビ辛麺とは、唐辛子のようなヒリヒリとした辛さではなく、山椒や花椒によるビリビリとシビれる辛味が特徴のラーメンのこと。今回は、東海3県でおすすめのシビ辛麺を厳選して紹介する。"
"2018-11-01 20:00","「TOKYO隅田川ブルーイング」シリーズ350ml缶の数量限定発売が決定!","アサヒビール株式会社(以下、アサヒビール)から、2018年11月6日(火)より「TOKYO隅田川ブルーイング」シリーズ2種の350ml缶の販売が開始します!それぞれの個性と味わいが光る2種類のビールを..."
"2018-11-01 18:00","老舗豚骨ラーメンから担担麺まで人気店が集結!福岡の「博多めん街道」ではしごラーメン!","JR博多駅直結の「博多めん街道」で食べ歩きはいかが?豚骨から醤油、味噌など多彩なラーメンで迎える麺処はどれも名店ぞろい。一品料理もチェックしよう!"
"2018-11-01 18:00","透き通ったスープは店主の努力の結晶!東海エリアで今行くべき“清湯醤油”ラーメンの店5選","見た目も美しく、素材の旨味と店主のこだわりがギュッとつまった奥深い味わいの清湯(ちんたん)醤油スープ。今回は日々そんなスープに磨きをかける、愛知県と岐阜県にある珠玉の5軒を紹介する。"
"2018-11-01 17:00","ラーメンとコーヒーが楽しめる!戸塚に誕生した新感覚のラーメン店","こだわりのラーメン店とおしゃれなカフェが融合した「YUKIMURA NOODLES & COFFEE」が2018年3月、戸塚にオープンした。陽のあたるテラスでくつろぎながら麺をすすり、シメにコーヒーを。この新感覚の店を紹介しよう!"
"2018-11-01 14:21","ロッテリア、約100gローストビーフ使ったご褒美バーガー","ロッテリアは22～29日までの8日間、「ブラックアンガス牛ローストビーフバーガー」の販売を行う。 ロッテリアは11月29日、「いい肉の日」にあわせたご褒美バーガーを毎年販売している。今年は約100gび..."
"2018-11-01 12:49","生ウニパスタが名物! 日本初出店! ハワイで人気のイタリアン「アランチーノOSAKA」が豊中にオープン","ハワイ屈指のイタリアンレストランarancino(アランチーノ)が、11月1日(木)に日本第一号店を大阪・豊中市にオープンする。arancino(アランチーノ)と言えばマリオネット・ホテルやザ・カハラ・ホテルなど、ハワイの名だたるホテルの中にも店を構える、著名人も御用達の本格派イタリアンレストラン。ハワイの3店舗で、年間述べ32万人が来店する人気店だ。"
"2018-11-01 12:28","ずわい蟹が香る炊き込みご飯…日本橋の「お米が主役」の和食店","J-WAVEで放送中の番組『STEP ONE』(ナビゲーター:サッシャ・寺岡歩美)のワンコーナー「7-ELEVEN LUNCH HUNTER」。10月31日(水)のオンエアでは、日本橋コレド室町にある..."
"2018-11-01 12:00","ミシュラン1つ星「東京丸の内・モナリザ」がおくる特別なカレーを食べて、デートに誘う方法","今回は、レトルトカレー『ミシュランが認めたフレンチ 東京丸の内・モナリザのブイヨン煮込みのフレンチカレー』をご紹介! ぜひぜひこのカレーを食べて、気になる女性を食事デートに誘ってくださいませ。■1:店..."
"2018-11-01 12:00","渋谷で懐かしのおふくろの味!REISM STANDが夜の時間限定で“リチャージャブル酒場”としてリニューアル","渋谷駅南口から徒歩10分ほどにあるカフェ「REISM STAND(リズム スタンド)」が夜の時間帯限定で、“リチャージャブル酒場”としてリニューアルした。"
"2018-11-01 12:00","ランチにも〆にもおすすめ!福岡市近郊で行くべき“うどん店”5選","福岡は多彩なルーツや個性がきらめきを放つ“うどん先進都市”。一度食べたらやみつきになる、福岡市周辺エリアのおすすめうどん店を紹介する。日々進化する福岡うどんをご堪能あれ!"
"2018-11-01 11:00","3種のシーフードのごちそうグラタン","寒くなってきたこの季節には、アツアツな『シーフードグラタン』なんていかがでしょう?今回は『牡蠣』と『ホタテ』を使いました。味の決め手は『カニ味噌』。海の旨味たっぷりな、ちょっと贅沢な一品です。意外と簡..."
"2018-11-01 11:00","栗づくしのコースやクレープ、大人パフェまで!個性派“栗スイーツ”6選","いよいよ栗の季節が到来!新しくオープンした新進気鋭のパティスリーから、斬新な栗スイーツをご紹介。＜※情報は関西ウォーカー(2018年10月23日発売号)より＞"
"2018-11-01 09:00","＜メイド・イン・九州＞セイカ食品の「ボンタンアメ」","九州のロングセラー商品の秘密にせまる「メイド・イン・九州」。今回は、セイカ食品の「ボンタンアメ」をピックアップ!"
"2018-11-01 08:05","14時前に売切れも 喜多方の名店仕込みの一杯は、肉厚チャーシューが12枚ビッシリ!","福島県・会津坂下(ばんげ)町の「喜多方らーめん 伊藤」は、喜多方の「一平」や「さゆり食堂」などの名店で経験を積んだ店主が開業した。〈※情報は発売中の「ラーメンWalker福島2019」より〉"
"2018-11-01 07:00","【スタバ新作】まるで“飲むショートケーキ”? イチゴ&ホイップの最強コラボを開発者に聞く",
"2018-11-01 05:03","「独りでいたくない…」本命の彼に失恋し、違う男に逃げた夜。女が心に抱く""ある打算”とは","美人は不美人より、生涯で3億円の得をする。まことしやかに囁かれる都市伝説だが、あながち嘘とは言い切れない。美味しい食事や高価なプレゼントに恵まれる機会も、美人の方がやはり多いに違いない。麗しくも華やか..."
"2018-11-01 05:02","その計算、男は何故見抜けない!? ボディタッチの強弱で人を操る、“ソフトタッチ”をするあざとい女","世の中には、なぜか“女に嫌われる女”というものが存在する。女がその女の本性に気づいても、男は決して気づかない。それどころか男ウケは抜群に良かったりするのだ。そんな、女に嫌われる女―。あなたの周りにもい..."
"2018-11-01 05:01","白金DINKSが後輩を誘い出すのは、ローカルで賑わうカジュアルなイタリアンでした","かつて、自分が若手だった頃。遊び方や飲み方はすべて先輩が教えてくれた。六本木や西麻布の艶やかさが日常になったとき、連れていかれた白金の桁違いの大人感に圧倒されたのを覚えている。そう、後輩を一つ上の世界..."
