"Time","title","Field3"
"2018-11-14 11:00","紅葉と一緒に楽しみたい!京都東山エリアの新しい味に出会えるカフェ4選","今が見ごろの紅葉の名所でもある清水寺や知恩院、高台寺が位置するエリアでもある東山地区。そんな、中心部からのアクセスがいい東山地区にお茶を使った新感覚ドリンクなど新しい味に出合えるカフェが続々登場!＜※情報は関西ウォーカー(2018年11月6日発売号)より＞"
"2018-11-14 11:00","【第5話】ドラマと一緒に楽しみたい!水10ドラマ「けもなれ」登場ビール","日テレ系水曜ドラマとして10月初めにスタートした『獣になれない私たち』(以下、けもなれ)。ビールを飲みながら楽しみたい、大注目のドラマです。現在第5話まで放送されています。どきどき展開のストーリーが楽..."
"2018-11-14 11:00","本場のビール文化に触れながら飲み比べ!「ベルギービールを愉しむ夕べ」潜入リポート","ベルギーは面積が九州ほどの小さな国にもかかわらず、ビールの銘柄が1,500以上、醸造所の種類が200以上もあるビール大国です。日本でも「ベルギービールウィークエンド」をはじめ、ベルギービールを楽しめる..."
"2018-11-14 11:00","＜福岡うどん愛＞揚げたての風味と音が楽しめる天ぷらは必食!「うどん めん天」","北九州を中心に勢力を拡大する人気うどん一派「豊前裏打会」の「うどん めん天」(北九州市若松区)。日々研究を続ける麺と揚げたてにこだわる天ぷらがウリ。変化球ではなく定番のメニューで勝負する同店の魅力に迫った。"
"2018-11-14 08:42","岩手出身元CAオススメ!一度食べたら忘れられない?岩手で絶対食べたい絶品冷麺","岩手県のソウルフード!盛岡冷麺もちもちの麺と牛テールのコクのあるスープがたまらない盛岡冷麺。岩手県では、一年中盛岡冷麺を食べます!今回は、岩手県に行ったらぜひ召し上がっていただきたい、美味しい冷麺のお..."
"2018-11-14 07:40","これは5分で売切れも納得! 肉盛り盛りの白河ラーメンに大興奮! 福島「麺屋 雅宗」","18年1月にオープンした、福島県白河市の「麺屋 雅宗」。「手打らーめん 雅」(同市)の創業者である店主が、息子に店を引き継がせて新規に開店した。〈■情報は発売中の「ラーメンWalker福島2019」より〉"
"2018-11-14 05:02","東京女、27歳:社会人5年目で迫られた、究極の選択。彼氏の転勤で「全て揃った東京」を離れられるか?","東京には、全てが揃っている。やりがいのある仕事、学生時代からの友だち、お洒落なレストランにショップ。しかし便利で楽しい東京生活が長いと、どんどん身動きがとれなくなる。社会人5年目、27歳。結婚・転勤な..."
"2018-11-14 05:01","年上バツイチ女に優しく近づいてきた、29歳のイケメン。完璧に見える男に隠された、意外な欠点とは","ーこの人と離婚して新しい人と再婚すれば、簡単に幸せになれると思っていましたーこれは、高い恋愛偏差値を誇る男女がひしめき合う東京で、再び運命の相手を求め彷徨うことになった男女のリアルな”再婚事情”を、忠..."
"2018-11-14 05:00","恵比寿のデート鮨なら絶対にここがオススメ!目にも美しくテンションがあがる名店","1年の締めくくりとなる12月は、贅沢なデートがしたくなる時期。そんな時におすすめなのが『鮨竹半 若槻』。強烈な印象を与えてくれる握りや料理に加え、サプライズも詰まった同店の魅力を動画でお伝えしよう!広..."
"2018-11-13 21:44","カニ味噌にイタリアン!? 愛知で食べる個性派”汁なしラーメン”5選","台湾まぜそばが登場して早10年。いまや定番名古屋めしとして確固たる地位を築いているが、それにけん引されるように、東海エリアにおいてスープのないラーメンが進化を続けている。ラーメンという枠を超え、和食、東南アジア料理、イタリアンなど、さまざまなジャンルのエッセンスを加えたメニューの数々は、スープがないからこそ組み合わせる食材の自由度が高く、それ故、店の個性が色濃く現れている。"
"2018-11-13 21:26","自慢の一杯を味わう!豊田市でいま食べたい絶品ラーメン5選!","担々麺に、豚骨、煮干し、ジビエなどなど、さまざまなラーメン店が集う愛知県豊田市。今回はラーメンウォーカーから、編集部が独断と偏見で選んだおすすめのラーメンを5つご紹介!"
"2018-11-13 20:50","北海道の海の幸がてんこ盛り!プリン体たっぷりな“悪魔的にうまい”鍋が、名古屋の居酒屋に登場!!","2019年2月末まで、名古屋にいながら北海道を堪能できる体験型居酒屋「毎日!北海道物産展!!ネオ炉端 道南農林水産部」で、北海道産の海鮮を贅沢に使った「禁断の鍋 北海!痛風鍋」(1人前1922円)が味わえる。"
"2018-11-13 18:00","新たな食の化学反応とムーブメント!愛知の洋風ラーメンが旨い店3選","昨今の東海エリアのラーメン界において急速に勢力を拡大しているのが、洋風ラーメンだ。イタリアンやフレンチなどで腕を鳴らしてきたシェフたちが新規参入。新たな食の化学反応とムーブメントを求めて、革新的な一杯を続々と発表している。美しすぎるビジュアルはもはや”非”ラーメン。しかし、味は洋食のエッセンスを強く感じながら、ラーメンとしての旨さを強く感じられる実力派がラインナップ。"
"2018-11-13 12:00","農林水産省・NHK・日本農業新聞の三冠達成!「もったいない精神」が生んだ佐賀発グリーンカレーとは?","皆さん、グリーンカレーはお好きですか?筆者はグリーンカレーが大好きです。今回食レポするご当地レトルトカレーは『伊万里グリーンカレー』。早く食べたい気持ちでいっぱいです。ですがその前に、「触れてくれ!」..."
"2018-11-13 11:45","「肉×ネギ」で濃厚なのにサッパリ! 「バラそば」は食べ始めると止まらない","J-WAVEで放送中の番組『STEP ONE』(ナビゲーター:サッシャ・寺岡歩美)のワンコーナー「7-ELEVEN LUNCH HUNTER」。この週は、ゲスの極み乙女、 DADARAYのベーシスト、..."
"2018-11-13 10:00","福岡・筑後エリア人気店の“まかない飯”が集結!「筑後七国 まかない飯グランプリ」開催","11月18日(日)、筑後広域公園(福岡県筑後市)で「第8回 筑後七国 まかない飯グランプリ」が開催される。"
"2018-11-13 07:45","福島・喜多方の「背脂ラーメン」3選! あっさりスープに背脂がこんなに合うなんて","喜多方ラーメンというと一般的にあっさり透明のスープの印象が強いが、一方で背脂を加えたラーメンも意外に支持を得ている。今回は、背脂が名物の喜多方ラーメンをセレクトしてみた。〈■情報は発売中の「ラーメンWalker福島2019」より〉"
"2018-11-13 06:30","来年20周年『北海道チーズ蒸しケーキ』はケーキなのになぜ“和菓子”? ヤマザキパンに聞く",
"2018-11-13 05:03","女の嘘:「私、一人じゃ生きていけない…」男が簡単に騙される“子鹿女”の裏の顔","女は、息を吐くように嘘をつく。それは何かと敵の多いこの世の中で、力に頼らず生き抜くために備わった、本能ともいうべき術なのだ。それゆえ女の嘘は自然であり、かつ巧妙。特に男が見破ることなどほぼ不可能である..."
"2018-11-13 05:02","これをやったら、結婚できない女まっしぐら?Over35女が出会いを求めなくなった理由","別に、結婚だけが女の幸せではない。自ら望んで独身を貫くのなら、何も問題はない。しかし実際には「結婚したいのに、結婚できない」と嘆く女たちが数多く存在し、彼女たちは今日も、東京の熾烈な婚活市場で戦ってい..."
"2018-11-13 05:01","「あの子キレイなのに…もったいない」31歳・交際経験ゼロの美女が、男の唇を頑なに拒む理由","私たちには呪いがかけられている。いつでもかわいらしく身ぎれいに、だって「女の子なんだから」。人の輪を乱さずに、まわりに気を配るの、だって「女の子なんだから」男性を立てて。プライドを傷つけちゃだめ、だっ..."
"2018-11-12 20:53","優しくて、どこか懐かしい。長年地元民に愛される東海の町中華のラーメン6選","安くて、おいしくて、ボリュームがあって、長年愛されてきた町の中華料理屋さん。レトロで懐かしい雰囲気も相まって、近年ひそかなブームが到来中だ。東海地方屈指の愛され＂町中華″を大紹介!"
"2018-11-12 20:00","博多弁VTuber・舞鶴よかと、福岡名物を“半額”で食べる!","博多弁VTuberとして話題のバーチャルキャラクター“舞鶴よかと”が、九州ウォーカー編集部から指令を受けて福岡のあらゆるところに出没する「九州・よかと・ウォーカー」。第5弾は、九州ウォーカー2018冬号の半額ラーメンクーポンを使って、初めてのラーメンリポートに挑戦するよ!"
"2018-11-12 20:00","冬だけのデザイン!『DHC ヴァイツェン [小麦のビール]』通販限定で販売開始","株式会社ディーエイチシー(以下、DHC)は、2018年11月8日(木)より、新商品「DHC ヴァイツェン [小麦のビール]」の2018年冬限定デザインバージョンを、数量限定で販売を開始しました。限定デ..."
"2018-11-12 17:48","「ラーメンWalkerグランプリ2018」千葉の新店ベスト3発表!","ラーメン情報誌「ラーメンWalker」(KADOKAWA)が行っている、旨いラーメン店を決めるランキング「ラーメンWalkerグランプリ」。「千葉総合」と2017年12月31日までにオープンした店舗を対象にした「千葉新店」の2部門で、読者と百麺人の投票によって選ばれた全国屈指の“旨い店”を大発表!今回はそのなかから、千葉新店ベスト3を紹介。<情報は「ラーメンWalker千葉2019」(2018年10月5日発売)より>"
"2018-11-12 17:00","ニューフェイスが続々!福岡で注目を集めるコーヒー店5選","”コーヒーの街・福岡”をアツくする新顔が、続々とお目見え。今回はオススメの5軒を紹介する。普段使いできる店を見つけて、コーヒーライフを充実させよう!"
"2018-11-12 17:00","日本を代表する店がしのぎを削る!キャナルシティ博多「ラーメンスタジアム」ではしごラーメン!","キャナルシティ博多(福岡市博多区住吉)にある「ラーメンスタジアム」。豚骨に醤油、味噌…エリア内に漂う芳しいスープの香りに期待度もMAX!日本を代表するラーメン店がしのぎを削る“ラースタ”で、ラーメンざんまいの、はしごツアーへいざ行こう!"
"2018-11-12 16:39","「PARM」シリーズに「フォンダン・ブロンドショコラ」「アーモンド&シルキーホワイト」が仲間入り","森永乳業は、アイスブランド「PARM」シリーズから「PARM フォンダン・ブロンドショコラ」と「PARM アーモンド&シルキーホワイト」を、11月26日より全国で発売する。 「フォンダン・ブロンドショ..."
"2018-11-12 13:23","「スーパーカップ」から、ストロベリーチーズフレーバーが5年ぶりに登場","明治は、本日11月12日より「明治 エッセルスーパーカップ ストロベリーチーズ」を発売する。 同商品は、なめらかでコクのあるアイスを、チーズの濃厚さと爽やかな酸味が感じられるストロベリーチーズの味わい..."
"2018-11-12 12:00","「道産牛の牛すじカレー」とめぐる、おすすめブランド和牛3種の食べ比べ","今回、筆者が食レポするレトルトカレーは『北海道 道産牛の牛すじカレー』!筆者は旅行好き(旅行といっても目的は観光ではなく、食べる方!)で2か月に1度は旅行しているのですが、北海道はまだ訪れていません。..."
"2018-11-12 12:00","自慢の一杯を味わう!宮崎のおすすめの豚骨ラーメン10選","絶対に食べておきたい宮崎市内の人気豚骨ラーメンをご紹介。自分好みの最高の一杯を求めて、ラーメン巡りを楽しもう!"
"2018-11-12 11:40","「どん兵衛 豚汁うどん」が3年ぶりに復活!","日清食品は、本日11月12日より「日清のどん兵衛 豚汁うどん」の販売を開始している。 同商品は、2015年に販売されていたが、今回3年ぶりに季節限定で復活。つゆは赤みそと白みそが合わせられており、豚肉..."
"2018-11-12 11:00","鮭のハーブマヨ焼き","オシャレなビール女子の好きなベルジャンホワイトとおもてなし料理でおうち女子会はいかがですか?寒くなってくると美味しい『鮭』に『ディル』とほんのり甘いマヨが絶妙な簡単レシピです!Recipe by 齊藤..."
"2018-11-12 07:40","その旨さに惚れた自衛官が除隊し店長に! 福島発ガッツリ系の新店「大須賀 白河店」","18年5月にオープンした、福島県白河市の「麺家 大須賀 白河店」。福島県のG系勢力を牽引してきた、郡山市の「麺家 大須賀」の4店舗目として白河市にオープンした。〈※掲載情報は発売中の「ラーメンWalker福島2019」より〉"
"2018-11-12 05:03","幼少時代の記憶が作り出した、歪んだ執着心。人の家庭を壊そうとした女が受けた""罰""とは","―この女、何かおかしいー自分だけがほんの少し感じた、しかし強烈な違和感。それをもし、未来の家族となる人に感じてしまったら…?大手化粧品会社で働く美香(32歳)は、公認会計士である夫の譲(35歳)と、平..."
"2018-11-12 05:02","「あなたが独身で、よかった」33歳女が生まれて初めて言われたセリフ。年下男に心を掻き乱された夜","ーただ、結婚していないというだけなのに。30代独身だというだけで、蔑まれ虐げられ、非難される…。その名も、独身ハラスメント。それとは一切無縁だったはずの莉央(33)は、ある日突然、独身街道に再び投げ出..."
"2018-11-12 05:01","ムダな食事会100回=お見合い1回分。婚活迷子が、見合い結婚に行きつく理由とは","ー結婚の正解が知りたいー未婚・既婚に限らず、「幸せな結婚とは?」と、頭を悩ませている者が多い現代。妥協婚、事実婚、国際結婚、授かり婚、年の差婚など、多様性があるからこそ迷ってしまうのも事実。未婚者は、..."
"2018-11-12 05:00","先週のアクセスランキング!1位は「「旦那さんとデートしてたね」妻は知らぬ、同僚からの夫の目撃情報。不審な女が夫婦を陥れた罠とは」","「東京カレンダーWEB」の1週間分のランキングから、人気記事ベスト5をご紹介!“不審な女が夫婦を陥れた罠”に“2人の男を翻弄する、危険な計画”から“年下男に迫られた時の正しい対処法”まで。さて、栄えあ..."
"2018-11-11 12:00","「道産豚の角煮カレー」を食べてつかんだ、レトルトカレーの法則とは","カレーション企画に参加してから数カ月がたち、少しはレトルトカレーに詳しくなった筆者です。今回レビューを担当するカレーは『北海道 道産豚の角煮カレー』!カレーに角煮がインされているなんて……筆者は脂身の..."
"2018-11-11 12:00","まるで宮城県南オールスター!ニボラー必食の一杯が味わえる「煮干そば食堂 片平小十郎」","「淡麗」「濃厚]「煮干し」「つけ麺」の4大勢力がしのぎを削る宮城のラーメン界。今回はニボラーにはたまらない煮干し尽くしの店を紹介する。"
"2018-11-11 12:00","新潟総合3位に輝いた気鋭のラーメン!「麺や来味 大形店」","百麺人&読者が選ぶ毎年恒例の「ラーメンWalkerグランプリ」。今回は2018年新潟の総合部門3位に輝いた、品数も多いオリジナリティあふれる店を紹介する。"
"2018-11-11 12:00","2連覇でついに殿堂店入り!不動の人気を誇る埼玉の極上ラーメン","毎年恒例の、百麺人&読者が選ぶ「ラーメンWalker GP」。2018年に埼玉総合部門を2連覇し、新たに殿堂店入りを果たした店が誕生、その理由を探ってみた。"
"2018-11-11 11:00","食べて幸せ!神奈川のおいしいチーズケーキ3選","11月11日は「チーズの日」。チーズを使ったスイーツといえば、チーズケーキが王道。同じチーズケーキでも個性はいろいろ。今回はこだわりが詰まった、神奈川のおいしいチーズケーキが味わえるお店を紹介。"
"2018-11-11 10:00","沖縄・竹富島の冬の旬を楽しむ「島テロワール」が誕生","沖縄・竹富島のリゾート「星のや竹富島」は、12月10日(月)から3月3日(日)まで、「島テロワール」という冬限定の料理コンセプトのもと、島の天・地・人(天候・土地・人の営み)が織り成すディナーを提供する。"
"2018-11-11 08:00","なんと13:00に売切れ閉店も!?   福島・白河の関近くで極上の手打ち麺を「やたべ」","福島県白河市の「手打中華 やたべ」は、手打ち麺にこだわる名店。麺は早朝4:00から青竹で打って丁寧に作る。黄金色に輝く鶏清湯スープも丹念な仕込みのたまものだ。〈※掲載情報は発売中の「ラーメンWalker福島2019」より〉"
"2018-11-11 05:06","ママ友に馴染めない…。妻たちの特殊な世界で、""夫の素性""を隠し続けた女が受けた報復","あなたが港区界隈に住んでいるならば、きっと目にしたことがあるだろう。透き通るような肌、絶妙にまとめられた巻き髪。エレガントな紺ワンピースに、華奢なハイヒール。まるで聖母のように微笑んで、幼稚園児の手を..."
"2018-11-11 05:05","憎悪、嫉妬、愛情…1人の女を巡って、6人の男女の思惑が交錯する、運命の夜","深窓の令嬢が、超リッチな男と結婚。それは社会の上澄みと呼ばれる彼らの、ありふれた結婚物語。有馬紅子(ありま・べにこ)もそんな物語の一人として17年間幸せに暮らしてきた。しかし突然、夫・貴秋が若い女と駆..."
"2018-11-11 05:04","ナゼ気がつかない?デート中に女が送っていた“脈あり”サインを見逃した、男の痛恨ミス","恋とは、どうしてこうも難しいのだろうか。せっかく素敵な出会いをしても、相手に「また会いたい」と思わせない限り、デートにも交際にも発展しない。仮に、順調に駒を進められても、ある日突然別れを突き付けられる..."
"2018-11-11 05:03","“あの女”の登場で、私の穏やかな日常が崩れていった…。「怪女-カイジョ-」全話総集編","―この女、何かおかしいー自分だけがほんの少し感じた、しかし強烈な違和感。それがもし、未来の家族となる人へ向けられたら…?大手化粧品会社で働く美香(32歳)は、公認会計士である夫の譲(35歳)と、平穏で..."
"2018-11-11 05:02","最近、焼肉よりしゃぶしゃぶがいいというあなたへ!都内の極上しゃぶしゃぶ5選","最近はがっつりな「焼き肉」よりも、「しゃぶしゃぶ」派という人も多いのでは?今回は絶対知っておきたい、東京都内のしゃぶしゃぶの名店をご紹介。こってり系だけじゃない、あっさり、さっぱりとした肉の楽しみ方を..."
"2018-11-11 05:01","ブランドを知ったかぶりしてるけど、シャンパンの違いって何?いまさら聞けないシャンパンの基礎知識","年末ムードが高まってくれば、何かと人と会う機会が増えるもの。そんな高揚感に華を添えてくれるのが、シャンパンだ。シャンパンを手にすればおのずと気分は高まるけれど、その種類は有名どころだけでもたくさんある..."
"2018-11-11 05:00","かぶりつくと幸せがやってくる!濃厚ふわふわなチーズスイーツ、「スフレバーガー」をご紹介!","昨年夏、麻布十番に初上陸し話題をさらった、フランス発のチーズケーキ&バターサンド専門店『beillevaire(ベイユヴェール)』。その新業態となるポップアップのスイーツスタンドが、六本木ヒルズ内に4..."
"2018-11-10 20:00","毎日の晩酌に彩りを! 玉ねぎを使ったおつまみレシピ","冷蔵庫にない日はないというくらい定番食材の玉ねぎなら、お手軽におつまみが作れていいですよね!日々ビール女子達がビールに合うおつまみを提案する「ビール女子Kitchen」から、今夜は玉ねぎを使ったおつま..."
"2018-11-10 18:00","連続受賞!ラーメン激戦区・埼玉で台頭する実力店「らーめん 勝～かねかつ～」","毎年恒例、百麺人&読者が選ぶ「ラーメンWalker GP」。2018年埼玉の総合二位に輝いたのは川口市にある「らーめん 勝～かねかつ～」。その端正なたたずまいと奥深い味わいが高く評価され、17年に続いての連続受賞となった。"
"2018-11-10 16:00","【インタビュー】ビールをつくるため夫婦でポートランドへ!ビールづくりの錬金術師女子ブルワー","ビール女子のみなさま、こんにちは!ポートランド在住の東リカです。ポートランドの女子ブルワーをリレー形式で紹介するこの企画。4人目は、前回のナタリーさんとガールギャングを結成するマディ(Madelein..."
"2018-11-10 13:00","ハレの日を演出してくれる博多・九州の美食空間へ","地下鉄の中洲川端駅に直結した施設「博多リバレインモール」。その中にある、「博多の砦」は、割烹の「海なぎ(みなぎ)」、会席・日本料理の「華彩都(はなさいと)」、寿司とワインなど和食をダイニングスタイルで提供する「SHUN’ NA(しゅんな)」、鍋料理の「なだ山(なだやま)」と、異なる雰囲気の4つの空間からなる食事処。箱庭のある個室や、夜景を望む席に、掘りごたつ席など、人数や用途に応じて使い分けができ、ビジネスから接待、デート、会食に、親族同士の顔合わせまでと、さまざまなシーンで重宝する店だ。"
"2018-11-10 12:00","ラーメンとカレーのいいとこどり!ホワイトシチューみたいな「とんこつカレー」","カレーが好きな人はラーメンも好き……そんなイメージをもっている筆者。もともとどっちも好きだ!という人もいるかと思いますが、どちらの方にとってもうれしいカレーがあります。今回ご紹介する『黒門屋らーめん ..."
"2018-11-10 12:00","種類が充実!福岡・博多駅エリアおすすめランチ5選","「いつもと違うランチが食べたい!」「今日のお昼、どうしよう」。そんなランチのお悩みをズバッと解決。土日祝も営業しているお店やごちそうランチ、コストパフォーマンスが高いランチを編集部がセレクトした。野菜料理にパン食べ放題、肉、魚、麺と種類が充実する福岡・博多駅周辺のランチ5つを紹介する。"
"2018-11-10 12:00","伊達政宗がこよなく愛した味噌を使った「戦国武将らあめん」期間限定販売","らあめん花月嵐は、「花月嵐・戦国武将らあめんシリーズ」第2弾として、「戦国武将らあめん 伊達政宗」(760円)を国内全店で2019年2月5日(火)まで期間限定で販売する。"
"2018-11-10 12:00","燕市の有名店が新潟市内で新たなガッツリ系を提案!「燕三条中華SOBA 鬼にぼ ONIMORI」","2018年の新潟ラーメン界のトレンドの一つだった、「人気店の新潟市内進出」。本店とはまた違う味わいにも注目だ。"
"2018-11-10 12:00","ボリューム満点、特盛無料!旨辛&G系好きはたまらない仙台の「麺屋とがし 龍冴」","■ 辛さ×コク×旨味あふれる極旨スープを極太麺で堪能!「麺屋とがし 龍冴(りゅうこ)」"
