"Time","title","Field3"
"2018-11-07 12:00","自慢の一杯を味わう!長崎のおすすめ豚骨ラーメン8選","絶対に食べておきたい長崎市内の人気豚骨ラーメンをご紹介。自分好みの最高の一杯を求めて、ラーメン巡りを楽しもう!"
"2018-11-07 11:10","福島で旬の新鮮な野菜がたっぷり摂れる!野菜とお鍋と揚げもんと。とまり木432¨","串カツやモツ鍋が人気の居酒屋「しゃかりき432¨新福島店」の新展開。奈良県明日香村から直送する、鮮度抜群の野菜をたっぷり味わえるピザや日替りメニューをはじめ、揚げ物に肉料理と幅広くそろう。＜※情報は関西ウォーカー(2018年10月23日発売号)より＞"
"2018-11-07 11:00","コーヒー×チーズにトニック!?驚きの組み合わせで楽しむ新感覚コーヒー","チーズクリーム×コーヒーやトニック×エスプレッソなど、今まで味わったことのない新感覚コーヒーが味わえる店がこちら。新感覚ながらもこだわりが詰まった本格派の一杯を味わってみて。＜※情報は関西ウォーカー(2018年10月23日発売号)より＞"
"2018-11-07 11:00","間借り営業から独立した、神奈川の実力派ラーメン3店","家系や神奈川淡麗系など数多の〝神ラーメン＂が集う神奈川は、年間に100軒近くの店がオープンする首都圏屈指の激戦区だ。独立を目指す若き店主たちは、さまざまな場所で腕を磨いている。そのなかで近年増えている「間借り営業」で話題になっていた、実績十分の店主たちが、ここ1年で続々と独立オープン。間借り営業とは、店舗の定休日などに店を借りて営業をすること。独立を目指す修業の場や自身の新しい試みの場として増えている。"
"2018-11-07 11:00","【今夜放送】気になるのはビール! 水10ドラマ「けもなれ」に登場したクラフトビール","日テレ系水曜ドラマとして10月初めにスタートした『獣になれない私たち』(以下、けもなれ)。ビールを飲みながら楽しみたい、今大注目のドラマです。現在第4話まで放送されていますが、ストーリーより編集部が気..."
"2018-11-07 11:00","なめらか且つ確かな飲みごたえ!『サッポロ 麦とホップ 冬小麦』が数量限定で登場","サッポロビール株式会社(以下、サッポロビール)より、『サッポロ 麦とホップ 冬小麦』が2018年11月13日(火)に数量限定で発売が決定! 大人気シリーズの冬だけの味わいが、年末の家飲みを盛り上げてく..."
"2018-11-07 10:55","本格的なチーズ酒場が京都にオープン!旬野菜とチーズの酒場 l'utubo","京都のイタリアンやビストロなどで経験を積んだ店長による「チーズと野菜」をテーマにした酒場「旬野菜とチーズの酒場 l'utubo」が登場。イタリアやフランス産を中心とするチーズのほか、手ごろな前菜や肉料理までメニューは幅広い。＜※情報は関西ウォーカー(2018年10月23日発売号)より＞"
"2018-11-07 10:50","何本でも食べたい!特製タレが絡む絶品牛串が自慢の鉄板牛串 アベ亭","鉄板牛串 アベ亭は、鉄板の上で肉に特製のタレを絡めながら焼き上げる、“カラメ焼き”が自慢の牛串専門店。味噌ダレとニンニクが効いた塩ダレを部位によって使い分ける牛串のほか、焼き野菜や牛を使った一品も提供する。＜※情報は関西ウォーカー(2018年10月23日発売号)より＞"
"2018-11-07 10:50","庭や周辺で紅葉が楽しめる!日本庭園を眺める和カフェならここ","絶品スイーツを味わいながら美しい庭や紅葉まで楽しめる、秋に行きたい和カフェを2店をご紹介!＜※情報は関西ウォーカー(2018年10月23日発売号)より＞"
"2018-11-07 10:45","500円以下の手作りおばんざいをアテに1杯!毎日通いたくなる居酒屋まさちゃん","ミナミの人気居酒屋「嬉々 わらまさ」が、「長町笑勝」に続く3号店をオープン。卸業者や市場から直接仕入れる鮮魚のお造りや豊富な焼魚をはじめ、おばんざいなどすべてが手作りのお手ごろなアテを豊富にそろえる。＜※情報は関西ウォーカー(2018年10月23日発売号)より＞"
"2018-11-07 07:50","福島・浪江町で懐かしの味が復活! ニンニクが効いた味噌ラーメンが名物「たき」","18年2月に移転オープンした「サッポロラーメン たき」(福島県浪江町)。南相馬市で40年以上親しまれた店が、16年に惜しまれつつ閉店。昔ながらの味を創業者の長男が引き継ぎ、18年に浪江町で復活した。〈※情報は発売中の「ラーメンWalker福島2019」より〉"
"2018-11-07 05:05","「これで最後だから…」最愛の女から届いた“サヨナラメール”。そこに隠されていた真実とは?","-なぜ今、思い出すのだろう?若く、それゆえ傲慢だった同級生・相沢里奈の、目を声を、ぬくもりを。これは、悪戯に交錯する二人の男女の人生を、リアルに描いた“男サイド”のストーリー。一条廉は3歳年上の美月と..."
"2018-11-07 05:03","「ねぇ、もう一回キスしてもいい?」31歳バツイチ女が、年下男に迫られた時の正しい対処法","ーこの人と離婚して新しい人と再婚すれば、簡単に幸せになれると思っていましたーこれは、高い恋愛偏差値を誇る男女がひしめき合う東京で、再び運命の相手を求め彷徨うことになった男女のリアルな”再婚事情”を、忠..."
"2018-11-07 05:02","頭皮ケアからインナービューティーまで。「年齢不詳になりたい」と言う男の、毎日のこだわり","「清潔感のある男性が好きです」ほぼ100%の女性が口にする、この言葉。普通のことをしているだけでは、女性の言う「清潔感」のラインを合格することはない。さらに仕事のデキる男性ほど、自身への美意識も高い..."
"2018-11-07 05:01","あの「飲める親子丼」で有名な名店は、夜の鶏鍋もすごいんです!","こだわり抜いて作られる究極の親子丼を提供する『鳥つね 自然洞』。だが、この店の魅力が最大限に発揮されるのは夜である。この時期食べたい究極の「鳥スープ炊き鍋」を動画で紹介しよう。特上親子丼の材料と作り方..."
"2018-11-07 05:00","新しい店よりも、長く付き合える店が欲しいと思ったなら。白金で人気のフレンチが最適だ!","長年続く名店から、新店まで、多くのフレンチが集う白金。40歳を前に、この地で勝負をすることを決めた若きシェフがいる。それが、『ラ・クレリエール』の柴田秀之シェフだ。自らも真の大人として、人をエスコート..."
"2018-11-06 20:00","【徹底比較】結局どこがオススメ? ビールが買える通販サイト17選","直接お店に行ってビールを買うのもいいけど、通販サイトを利用すれば重たい荷物を持たなくてOK!それだけでなく、サイトごとにポイントが貯まったり、珍しいビールに出会えたりと通販でビールを買うメリットはたく..."
"2018-11-06 19:20","チーズスイーツばかり!「ナウ オン チーズ」、ルミネ新宿にオープン","手土産・テイクアウトに特化したチーズスイーツ専門店「ナウ オン チーズ(now on Cheese)」が、11月7日からルミネ新宿店ルミネ2(1階)にオープンする。 同店は、こだわりのチーズを贅沢に練..."
"2018-11-06 18:51","リエカレーの連載7食目「イーカスークのソヤナゲットカレーは遅かれ早かれ食べるべき!」","最近ローカル番組などでも紹介されることの多いグルメタウン、福島にいってまいりました!今夜どこかで一杯引っ掛けたい…と思ったときに、大阪から一駅でいける(なんなら歩いていける)福島には穴場なお店がたくさんあります。"
"2018-11-06 18:30","スイーツライター・ミシェルの “福岡スイーツ愛” vol.1 博多阪急モンブラン編","明太子、ラーメン、もつ鍋、水炊き、鮮魚に焼鳥etc…。とにもかくにも、「うまい!」がそろう福岡は、スイーツの宝庫でもあります。九州各地のものはもちろん、全国の名店、人気店のものまで、多種多彩なスイーツが集まるのも福岡という地ならでは。"
"2018-11-06 18:13","武蔵小杉で店内グランピング!ロティサリーチキンとクラフトビールと一緒に","武蔵小杉駅の北口、JR南武線周辺は、再開発と昔ながらの風景が混在したエリア。そんな場所に2018年4月にできた施設が「COSUGI COMMONS(コスギコモンズ)」だ。2017年に竣工したタワーマンションの1階となる。新丸子から移転した「ブーランジェリーメチエ」、神奈川初上陸の「猿田彦珈琲」などハイセンスな店がテナントとして並ぶ中、注目を集めているのが「COSUGI LODGE(コスギロッジ)」だ。"
"2018-11-06 18:00","コクと食べ応えがクセになる!愛知で外せない、G(ガッツリ)系ラーメン店4選","見た目のインパクトと驚きのボリュームを武器に、ラーメン界において唯一無二の存在感を誇るG(ガッツリ)系。極太麺の上にはモヤシやキャベツをたっぷりと盛りつけ、厚切りチャーシューをのせるのが一般的なスタイルだ。コシの強い麺に負けないよう、スープは濃厚な豚骨系。そこに背脂を加えることで、コクと食べ応えがアップする。G系の完成はニンニクを入れてこそ!ニオイを気にせず一気に食べよう。"
"2018-11-06 17:30","スヌーピーと一緒に帝国ホテル 東京の特別コース料理を堪能!","帝国ホテル 東京(東京都千代田区)の本館1階にあるオールデイダイニングのパークサイドダイナーで、5回目となる「料理長スヌーピーのレストランプラン 5th Story[パークサイドダイナー]」を開催中。"
"2018-11-06 17:19","「しゃぶ葉」が200店舗達成!ドリンクバー付き「豚バラコース時間無制限食べ放題」が999円","しゃぶしゃぶ食べ放題を展開する「しゃぶ葉」は、期間限定で「200店舗達成お客様感謝キャンペーン」を実施している。 今回のキャンペーンは、同店がに国内200店舗目となる「しゃぶ葉 京都北大路店」(京都府..."
"2018-11-06 17:00","一度は食べてみたかった!駅ホームにある立ち食いうどん店を巡る旅","今回は一日、駅のホームにある立ち食いうどん店を巡って、お店の様子をレポート!北九州の愛され店から大牟田のローカル店まで、絶品うどんをすする旅に出かけよう!"
"2018-11-06 15:03","どん兵衛全部入りなめんなよ! 食ったらホントに“どリッチ”だった!","今回紹介するのは“夢の具材全部のせ”を謳った「日清のどん兵衛 どリッチ 全部のせそば」(税別313円)です。ぱっと見、油揚げと天ぷらが乗ったニコイチ仕様という体ですが、これがねぇ、売ってないんですよ。..."
"2018-11-06 13:34","和洋折衷! ゴディバの“極み”はほろ苦い大人の味","食レポ担当なのに、実はけっこう偏食だったりする浦和武蔵です。 フリーランスで仕事をしていると、始業時間や昼休みなどの概念がないので、ご飯を食べる時間も回数も内容も毎回バラバラで、気付いたら一日ポテチし..."
"2018-11-06 13:30","大分・宇佐の4大グルメと酒蔵8蔵が集結!「宇佐グルメフェスタwith酒蔵まつり」","11月11日(日)に大分県宇佐市で「宇佐グルメフェスタwith酒蔵まつり2018」が開催される。"
"2018-11-06 12:21","パリッとジューシー! 「からあげグランプリ」2年連続で最高金賞、うまみの決め手は“3つの黄金比”","J-WAVEで放送中の『GOLD RUSH』。11月2日(金)のオンエアでは、お休みの渡部 健に代わり、相方の児嶋一哉がナビゲーターを担当しました。「HUNGRY OUT」のコーナーでは、「からあげグ..."
"2018-11-06 12:00","“甘くて辛い 大阪の味”とはこれいかに?知る人ぞ知る「堂島カレー」を食べてみた!","「『甘くて辛い』ってどういうこと!?」「まあ、いっぺん食べてみて!!」という、コックさん同志の会話が描かれたイラストから始まる『堂島カレー』の公式サイト。実は筆者、堂島カレーを完食したあとに公式サイト..."
"2018-11-06 12:00","自慢の一杯を味わう!熊本郊外のおすすめ豚骨ラーメン6選","絶対に食べておきたい熊本県郊外の人気豚骨ラーメンをご紹介。自分好みの最高の一杯を求めて、ラーメン巡りを楽しもう!"
"2018-11-06 11:45","ぷりっぷり牡蠣ソテーがのった、とろ～りチーズのグラタン&ドリアを代々木八幡で!","J-WAVEで放送中の番組『STEP ONE』(ナビゲーター:サッシャ・寺岡歩美)のワンコーナー「7-ELEVEN LUNCH HUNTER」。この週はとろ～り食感が癖になるチーズランチを紹介! 11..."
"2018-11-06 11:39","たっぷりチーズの幸せ!神奈川のおいしいパスタ&ピザ3店","11月11日は「チーズの日」。肌寒くなってくると食べたくなる、とろ～りアツアツの「チーズ」! チーズとテッパンの相性を誇るパスタ&ピザ。とろ～りアツアツのチーズを満喫できる、チーズが主役の名物メニューが味わえる神奈川の3店を紹介しよう!"
"2018-11-06 11:30","スヌーピーをテーマにしたカフェが阪急西宮ガーデンズに期間限定オープン!","2018年11月7日(水)、西宮阪急4階(兵庫県西宮市高松町14-2)にオープンする「PEANUTS(ピーナッツ)」のライフスタイルショップ「Peanuts LIFE & TIMES」。同日、阪急西宮ガーデンズ2階にあるBARBARA GOOD SWEETS TABLEの店内に「PEANUTS Cafe(ピーナッツカフェ)」が期間限定で登場する。"
"2018-11-06 07:45","仙台の名店が故郷・福島の相馬市へ! 極めた無化調の一杯にリピーター殺到「井戸端よしお」","福島県相馬市の「酒の肴と中華そば 井戸端よしお」は、仙台の人気ラーメン店「くろく」の店主が、地元の相馬でプロデュースした店。〈※情報は18年10/25発売の「ラーメンWalker福島2019」より〉"
"2018-11-06 05:04","「私たちの関係は、何だったの...?」恋と友情のあいだで苦悩した女。最後の哀しき願いとは","―あの頃の二人を、君はまだ覚えてる?誰もが羨む生活、裕福な恋人。不満なんて何もない。でもー。幸せに生きてるはずなのに、私の心の奥には、青春時代を共に過ごした同級生・廉が常に眠っていた。人ごみに流..."
"2018-11-06 05:03","美人なのに、なんか残念。結婚できないOver35の女に漂う“場末感”の正体とは","別に、結婚だけが女の幸せではない。自ら望んで独身を貫くのなら、何も問題はない。しかし実際には「結婚したいのに、結婚できない」と嘆く女たちが数多く存在し、彼女たちは今日も、東京の熾烈な婚活市場で戦ってい..."
"2018-11-06 05:02","「また会えて嬉しいよ」7年間“プロ独身”を貫いたハイスペ男に潜む、底知れぬ闇","私たちには呪いがかけられている。いつでもかわいらしく身ぎれいに、だって「女の子なんだから」。人の輪を乱さずに、まわりに気を配るの、だって「女の子なんだから」男性を立てて。プライドを傷つけちゃだめ、だっ..."
"2018-11-06 05:01","素直になれずすれ違う、男女の恋の結末は?いよいよ明日で最終話!「恋と友情のあいだで～廉 Ver.～」全話総集編","-なぜ今、思い出すのだろう?若く、それゆえ傲慢だった同級生・相沢里奈の、目を声を、ぬくもりを。あの頃の僕らは未完成で、足りない何かを探しては傷つき、欲することに夢中だった。だから気づかずにいたんだ。ず..."
"2018-11-05 21:33","博多弁VTuber“舞鶴よかと”、博多阪急のチョコレートケーキを食べ尽くす!","博多弁VTuberとして話題のバーチャルキャラクター“舞鶴よかと”が、九州ウォーカー編集部から指令を受けて福岡のあらゆるところに出没する「九州・よかと・ウォーカー」。第4弾は、博多阪急の個性豊かなチョコレートケーキをリポートする!"
"2018-11-05 20:59","具がゴロゴロ、バーモントカレーとジャワカレーのカレーパンが阪急うめだ本店に登場!","グランカルビーやモモフクヌードルなど、独自の限定商品で話題を呼んでいる阪急うめだ本店に新たな名物が登場。11月14日(水)、ハウス食品とコラボしたカレーパン専門店「カレーパンノヒ」がオープンする。これまでは江崎グリコや亀田製菓など菓子メーカーとコラボしてきたが、10月に登場した日清食品とのコラボ「モモフクヌードル」を第1弾に、惣菜のギフト化にも取り組み始めた。"
"2018-11-05 18:00","沖縄・オクマ プライベートビーチ&リゾートがレストランメニューを一新!","沖縄・国頭村(くにがみそん)のリゾート「オクマ プライベートビーチ&リゾート」は、「伝統と改革の融合」をテーマに食の改革プロジェクトを始動、10月から、ホテル内3つのレストランで新メニューの提供を開始した。"
"2018-11-05 17:22","スタバ、抹茶ドリンクを「大阪府限定」で発売","スターバックス コーヒー ジャパンは、11月12日から21日までの期間限定で、大阪府内105店舗にて限定ビバレッジ「大阪 めっちゃ 抹茶 ラテ(Hot/Ice)」「大阪 めっちゃ 抹茶 フラペチーノ」..."
"2018-11-05 17:00","こだわりの一杯を味わう!宮崎郊外でおすすめのラーメン店5選","絶対食べたい宮崎郊外の人気ラーメン店5選をご紹介。地元の人にも観光客にも愛される味は、足を運ぶ価値あり!自分好みの最高の一杯を求めて、ラーメン巡りを楽しもう!"
"2018-11-05 13:30","お肉が食べたい!福岡・中州&春吉エリアおすすめランチ3選","「いつもと違うランチが食べたい!」「今日のお昼、どうしよう」。そんなランチのお悩みをズバッと解決。土日祝も営業しているお店やごちそうランチ、コストパフォーマンスが高いランチを編集部がセレクトした。肉系メインのランチが中華、ボリューミーなハンバーガー、焼肉とそろう福岡・中州&春吉エリアのランチ3つを紹介する。"
"2018-11-05 13:00","おやつにランチに食べたい!福岡・筑豊エリアおすすめパン屋さん4軒","農産物など、地元産食材が充実している筑豊エリア。地元産野菜を使うサンドや地元の卵を使ったパンなど、地域密着型のパン屋さんが集う。パンとランチが楽しめる図書館併設のカフェなど、オシャレなスポットにも立ち寄りたい。"
"2018-11-05 12:15","山口智充が伝授! 旨味を逃さないシイタケの焼き方は…","J-WAVEで放送中の番組『TOYOTA DRIVE IN JAPAN』(ナビゲーター:山口智充・浦浜アリサ)。11月はTOYOTA ROOMYに乗って、千葉へ秋のバーベキュードライブ! 11月2日(..."
"2018-11-05 12:00","魅惑のコラボ!「銀河鉄道999」×「焼きカレー」の美味しさは銀河を超える!?","突然ですが、皆さん。『銀河鉄道999(ぎんがてつどうスリーナイン)』というアニメ作品をご存知でしょうか。『宇宙戦艦ヤマト』などを世に生み出した希代のアニメーター、松本零士(まつもとれいじ)先生の名作で..."
"2018-11-05 11:00","ビールとの相性バツグン!『ベーコン』を使ったおつまみレシピ30品","フライパンでカリカリに焼いたり、食材に巻いて楽しんだり、どんな料理にも合わせやすい『ベーコン』。冷蔵庫に常備している方も多いのでは? 日々ビールに合うおつまみを提案する「ビール女子Kitchen」から..."
"2018-11-05 11:00","サツマイモとナッツのちりめん山椒炒め","『ちりめん山椒』が具材と調味料両方の役割をはたしてくれるので失敗知らずの超簡単メニュー!甘辛味の『サツマイモ』に『ナッツ』の食感が加わってブラウン系のビールによく合います♪Recipe by いづみー..."
"2018-11-05 11:00","ダイヤモンド麦芽使用の至極の一缶。年始を祝うプレモル初仕込シリーズ販売決定!","2019年1月15日(火)からサントリービール株式会社より、『ザ・プレミアム・モルツ 初仕込』『ザ・プレミアム・モルツ〈香る〉エール 初仕込』の数量限定発売が決定。大人気シリーズのこの時期にしか飲めな..."
"2018-11-05 09:56","本日発売! “お茶の味がする”雪見だいふく登場!?","もう11月ですね! 浦和武蔵です。個人的に11月は、自分が好きだったり興味があったりするイベントなどが、どこかしらで毎週のように何か開催されていたりするので、実は1年で一番忙しい月なんじゃないかと、近..."
"2018-11-05 08:10","本日から!串カツ田中、串カツ食べ放題が1,111円","串カツ田中は、11月5日から11月15日までの期間限定で、串カツ11種食べ放題を1,111円で提供する。 同イベントは、11月11日が一般社団法人日本記念日協会から「串カツ田中の日」と認定されているこ..."
"2018-11-05 08:00","独学で見出した白河ラーメンの理想形! 地鶏の芳醇な旨味で魅了・福島「麺屋 左吉」","福島県西白河郡矢吹町の「麺屋 左吉」。店主は白河で短期の修業を経て開業。事実上独学で完成させたというその味の神髄は地鶏だ。会津地鶏など2種の鶏ガラと丸鶏をたいたスープは、鶏の旨味に注力するがゆえに、醤油ダレは控え目の淡麗系。自家製手打ち麺もモチモチ食感で力強い。"
"2018-11-05 05:06","「旦那さんとデートしてたね」妻は知らぬ、同僚からの夫の目撃情報。不審な女が夫婦を陥れた罠とは","―この女、何かおかしいー自分だけがほんの少し感じた、しかし強烈な違和感。それをもし、未来の家族となる人に感じてしまったら…?大手化粧品会社で働く美香(32歳)は、公認会計士である夫の譲(35歳)と、平..."
"2018-11-05 05:04","これって、ただの見せしめ…?友人の結婚式で“晒し者”にされる、30代・独身女たちの苦悩","ーただ、結婚していないというだけなのに。30代独身だというだけで、蔑まれ虐げられ、非難される…。その名も、独身ハラスメント。それとは一切無縁だったはずの莉央(33)は、ある日突然、独身街道に再び投げ出..."
"2018-11-05 05:03","結婚しても夫がずっと“女”として見てくれる。婚活の選択肢の1つである、国際結婚のリアルとは?","ー結婚の正解が知りたいー未婚・既婚に限らず、「幸せな結婚とは?」と、頭を悩ませている者が多い現代。妥協婚、事実婚、国際結婚、授かり婚、年の差婚など、多様性があるからこそ迷ってしまうのも事実。未婚者は、..."
"2018-11-05 05:02","私の中の“彼”は、いつまでも消えない...。いよいよ明日で最終話!「恋と友情のあいだで ～里奈 Ver.～」全話総集編","―あの頃の二人を、君はまだ覚えてる?誰もが羨む生活、裕福な恋人。不満なんて何もない。でもー。幸せに生きてるはずなのに、私の心の奥には、青春時代を共に過ごした同級生・廉が常に眠っていた。人ごみに流..."
"2018-11-05 05:01","日本のフレンチを支えてきた名店! 圧倒的なプロの技は、自身の仕事観にも影響を与える!","本物志向が強い街・白金。この街で32年に渡り、続いてきたフランス料理店があるのをご存知だろうか。その名も『コート ドール』。全国に名を轟かす名店であり、シェフの味を求めて、同業者も頻繁に訪れるという。..."
