"Time","title","Field3"
"2018-11-10 11:00","毎日の晩酌に彩りを! 玉ねぎを使ったおつまみレシピ","冷蔵庫にない日はないというくらい定番食材の玉ねぎなら、お手軽におつまみが作れていいですよね!日々ビール女子達がビールに合うおつまみを提案する「ビール女子Kitchen」から、今夜は玉ねぎを使ったおつま..."
"2018-11-10 07:50","福島・いわきの肉自慢ラーメン3選! 丼を埋め尽くすチャーシューに大満足","肉がたっぷりのラーメンは、食欲をそそられずにはいられない。最近新店が増えつつある福島県いわき市から、肉が人気のラーメンをセレクトしてみた。〈※掲載情報は発売中の「ラーメンWalker福島2019」より〉"
"2018-11-10 05:05","わかりやすいブランド品はNG、外食は個室のみ…。お金はあっても自由がない女の、空虚な毎日とは","先祖代々受け継がれし名声と財産。それを守り続けるために、幼い頃から心身に叩き込まれる躾と品位。名家の系譜を汲む彼らは、新興のビジネスで財を成した富裕層と差別化されてこう呼ばれる。「オールドリッチ」と。..."
"2018-11-10 05:03","「2人じゃなくて、みんなで」と彼女が言ったのはナゼ?女が男にして欲しい“ある行動”とは","私たちはこれまでに散々、LINEやデートのHow toを学んできた。しかし、やっとの思いでLINEやデートに漕ぎ着けても、失敗の可能性は常につきまとうのだ。あんなに盛り上がったはずなのに、突然の既読ス..."
"2018-11-10 05:02","今夜、目黒で飲んでいかない?帰り道のちょい飲みにぴったりな酒場を発見!","今夜はちょっと飲んで帰りたい夜に最適な街・目黒。今回はそんな目黒にある名店『酒場 シナトラ』を紹介したい。酒好きの心をがっしり掴む酒場の魅力をお伝えしよう。目黒駅から徒歩すぐのビル地下1階に位置超人気..."
"2018-11-10 05:01","肉々しい食感が堪らない!お腹を減らしきって堪能したい「ひき肉ライス」の専門店があった!","閑静な住宅地のなか上質な店がひしめく白金では、1,000円以下でお腹を満たなんて至難の業!と思っていた東カレ編集一行。しかし、さすがはグルメ通で知られるミュージシャン。この街でも、財布に優しいこだわり..."
"2018-11-10 05:00","東京駅で、一番人気の丼はこれだ!「第3回 東京駅丼グランプリ」トップ10を発表!","現在、東京駅周辺の9つの商業ゾーンにて絶賛開催中なのが、東京駅の丼メニューの頂点を決める「第3回 東京駅丼グランプリ」。秋の味覚や各店舗の特徴を日本の伝統的な食文化である“丼”で表現した、バラエティに..."
"2018-11-10 04:00","東京駅丼の頂点が決定!「第3回 東京駅丼グランプリ」ベスト10","東京駅周辺の9つの商業ゾーンでは、10月1日(月)から11月18日(日)までの期間、「第3回 東京駅丼グランプリ」が開催中。11月10日(土)、審査結果と今年のグランプリが発表された。"
"2018-11-09 23:06","ふわふわの生クリームがたまらない!「生クリーム専門店 ミルク」が梅田初の店舗オープン","究極の生クリームを提供する「生クリーム専門店 ミルク」の新店舗が11月8日、大阪・梅田の阪急三番街南館にオープン!大阪で3店舗目、初の梅田エリアの店舗を記者がレポートします。"
"2018-11-09 22:41","人気タイ料理店マンゴツリーカフェが名古屋初上陸!早くも話題の新店を女子大生が実食レポ","2018年11月9日、「名古屋ラシック」(名古屋市中区)にタイ料理レストラン「マンゴツリーカフェ 名古屋ラシック」がオープンした。東海初出店となるこちらの店は、本場・タイの人気店。ロンドン、香港、東京、大阪などに続いて、系列店では23店舗目のオープンとなる。"
"2018-11-09 21:04","「森ちゃんのラーメンフェスタ2018」開幕! 森たけしアナが「す・またん!」で紹介した極うまラーメン20店が登場","JR大阪城公園駅前広場で11月9日(金)、ラーメンイベント「森ちゃんのラーメンフェスタ2018」が始まった。"
"2018-11-09 20:00","Fa Yeast Bewingから海外コラボレーション商品『Fa Yeast Exta But IPA』販売決定!","Far Yeast Brewingは2018年11月13日(火)より、香港の新進気鋭のブルワリー「Gweilo Beer鬼酒」(以下、Gweilo)とのコラボレーション商品『Far Yeast E..."
"2018-11-09 19:07","実食レポ!福岡・博多の超有名店「ラーメン海鳴」が名駅に上陸!!","2018年11月9日(金)、JR名古屋駅構内にある「名古屋驛麺通り」に、福岡・博多の超有名店「ラーメン海鳴(うなり)」がオープンした。読者やラーメンの有識者による投票で人気店を決める「ラーメンWalkerGP」の福岡・九州エリアにおいて、3年連続1位を獲得している実力店だ。常設店としては県外初出店ということで、オープン前日にひと足早く行ってきた!"
"2018-11-09 19:04","深夜0:00まで営業!名古屋・栄の中心に、イチゴづくしのスイーツ専門店がオープン!","11月9日(金)15:00、名古屋の中心地・栄エリア(名古屋市中区)に、名古屋初となるイチゴスイーツの専門店「STRAWBERRY HUNTING(ストロベリーハンティング)」がオープンした。"
"2018-11-09 19:00","スタバが大阪出店20年!“めっちゃ抹茶”な期間限定ドリンクが登場!","スターバックスは大阪出店20周年を記念し、2018年11月12日(月)から21日(水)まで、“STARBUCKS 20th Anniversary in OSAKA”を開始する。この10日間を「OSAKA 20th Thanks week」とし、大阪府内105店舗で限定ビバレッジを販売(※なくなり次第終了)する。"
"2018-11-09 17:30","帰宅前に一杯いかかが?名古屋駅でいま食べたい話題のラーメン店5選!!","名古屋駅周辺にさまざまなラーメン店が登場する今日この頃。「名古屋でラーメンが食べたい!でも選べない!!」今回はそんなあなたに贈る、編集部が独断と偏見で選んだ、名古屋駅付近でいま話題のラーメン店を紹介!"
"2018-11-09 17:09","馬肉料理が自慢の大衆酒場!立ち飲み&着席の両スタイルで楽しめる","馬肉料理が自慢の大衆居酒屋が2018年7月11日、元住吉にオープンした。「馬刺」(600円)や「馬肉メンチ」(450円)、「馬肉ソーセージ」(650円)」のほか、珍しい「馬白子ポン酢」(500円)など馬肉料理が目白押しの店で、馬肉は部位ごとに世界や国内から吟味している。お酒は、ビールやサワーなどそろえるが、なかでも日本酒が自慢で、新潟県「諸橋酒造」の「越乃景虎」(1合500円)など厳選した8種を取りそろえている。1階は立ち飲み、2階は着席で、1階の方が価格が少しリーズナブルな設定。平日は17:00～19:00毎日ハッピーアワーを開催している。"
"2018-11-09 16:30","2018年のディズニーホテルXmasブッフェ!シェフ一押しのメニューは?","東京ディズニーランドホテル内にある、ヴィクトリア朝様式の美しい庭園に面した広い店内で、ブッフェメニューが楽しめるレストラン「シャーウッドガーデン・レストラン」。同レストランでは、12月19日(水)まで「“ディズニー・クリスマス” ランチブッフェ/ディナーブッフェ」(ランチ大人4000円/ディナー大人5000円)を提供中だ。"
"2018-11-09 16:16","マック、ハッピーセット「プラレール」「リカちゃん」を16日発売","日本マクドナルドは、11月16日から期間限定でハッピーセット「プラレール」「リカちゃん」を発売する。 ハッピーセット「プラレール」は、第1弾と第2弾に分かれて、8種のおもちゃとひみつのおもちゃ1種で、..."
"2018-11-09 15:00","食べたら思わず笑顔になる!福岡・幸せパンランチ5選","パンのランチが食べたい!そんなときにおすすめの、旬の食材を使った料理はもちろん、自家製パンにも自信ありの福岡市内の5店舗を紹介する。気に入ったパンは購入もOK!お店で焼きたてを楽しもう。"
"2018-11-09 12:05","曜日ごとに違う食パン専門店が登場!阪神百貨店「パンワールド」おすすめ食パン7選","阪神梅田本店の「食パンセレクトショップ」の11月は、曜日別に毎日約15ブランドの食パンが並び、計41店の食パンが登場するというパン好き大興奮の充実度。今ブームの高級商品や個性派アレンジ食パンまでそろうラインナップから、編集部おすすめ11月登場の注目食パンをご紹介!ぜひ通って食べ比べよう。＜※情報は関西ウォーカー(2018年11月6日発売号)より＞"
"2018-11-09 12:00","とろけるお肉に舌鼓!レトルトの常識をくつがえす「赤城牛ビーフカレー」","今回いただくのは、『赤城牛ビーフカレー』。シンプルで上品な質感のパッケージには、びっしりとメッセージが。赤城山麓の澄み切った空気と利根川始流の清らかな水のもとで健やかに育った味の逸品・赤城牛。カレーや..."
"2018-11-09 12:00","わざわざ食べたい!ご当地の味がギュッと詰まった九州のごちそう駅弁8選","ワクワクな電車の旅に豪華な""ごちそう""駅弁があれば楽しさアップ!今回はわざわざご当地に行ってまで食べたくなる、九州のごちそう駅弁を8つご紹介する。"
"2018-11-09 12:00","ラーメン新激戦区・川越がアツイ!見逃せない注目の新店3選","新店や人気店のリニューアルなど、埼玉のラーメン新激戦区として盛り上がる川越エリア。小江戸と称される川越の街で、今食べたい3軒をピックアップ!"
"2018-11-09 11:00","日本人初のTAPSTERが誕生したばかり!『ピルスナーウルケル』って知ってる?","ビール女子のみなさんは『ピルスナーウルケル』というビールをご存知ですか?これは、チェコを代表するビールでピルスナーの元祖ともいわれています。しかし、日本では提供するお店が少なく、知名度はあまり高くあり..."
"2018-11-09 11:00","しめ鯖のコッチョリ","『コッチョリ』とは韓国料理の一つで、野菜をヤンニョム(キムチの素)などの合わせ調味料で和えたもの。熟成させないキムチの浅漬け、生キムチといったところです。今回は自家製のヤンニョムを作って、『しめ鯖』と..."
"2018-11-09 07:50","衝撃的な辛さ! あの台湾ラーメン元祖の味を福島・郡山で体験せよ「味世」","福島県郡山市の「元祖名古屋台湾ラーメン 味世(みせい)」は、名古屋発の激辛麺・台湾ラーメンの元祖「味仙」による、愛知県以外で初の分店となる。〈※情報は発売中の「ラーメンWalker福島2019」より〉"
"2018-11-09 05:05","豹変してしまった、私の夫。二度と現れないはずのストーカー女が、夫婦の心に残した深すぎる爪痕","突如僕の人生に現れた黒髪の美女・ひとみ。僕はその美貌と清楚な雰囲気に夢中になったけれど、実態は異常な女だった。ひとみによって巻き起こされるトラブルを解決してくれた、昔からの女友達・雅子と結婚したのにも..."
"2018-11-09 05:04","「2人だけの秘密やで…?」小悪魔系の童顔美女が、裾をギュッと掴み甘えてきた夜","東京の酒場に、夜な夜な集う美女たち。もし偶然、あなたの隣に彼女が来たら…?美女とどんな会話をして、どんな時間を一緒に過ごしたいだろうか―。ここは、下北沢にある1軒のワインバー。俺は取引先との打ち合わせ..."
"2018-11-09 05:03","想定外妊娠:家族のぬくもりを知らない男が、父になる覚悟を決めた瞬間。彼が目に涙を浮かべたワケ","「結婚なんかしない」そう、言い張っていた。今の生活を手放すなんて考えられない。自由で気まぐれな独身貴族、それでいいと思っていた。仕事が何より大事だと自分に言い聞かせ、次々にキャリア戦線を離脱してゆく女..."
"2018-11-09 05:02","恵比寿の人気店!行けば必ず驚きと発見があるオシャレ酒場を徹底解剖!","「日本酒はちょっと苦手…」そう思っている人にこそ、今回紹介する『GEM by moto』を訪れて欲しい。ここを訪れれば必ず、「こんなに美味しいの?」という新しい発見や、「この味と合う!」という嬉しい驚..."
"2018-11-09 05:01","この“TKG”はズルい!銀座で大人焼き肉デートなら、本日オープンのこのお店!","『うしごろエス』や『上』など、立ち上げた新ブランドを軒並み成功させてきた「うしごろ」が、本日11/9(金)に銀座にオープン。それが、『焼肉うしごろ 銀座並木通り店』。ブランドの主軸である「焼肉うしごろ..."
"2018-11-08 19:20","大阪限定メニューも! 「ジョニーハイボール」体験イベント、大阪上陸","世界中で愛されているウイスキーブランド・ジョニーウォーカーの体験型イベント「JOHNNIE&HIGHBALL」が、大阪・梅田のグランフロント大阪 うめきた広場にて12月2日(日)まで開催されている。大阪で同ブランドの体験型イベントが行われるのは初めてで、大阪にちなんだハイボールなど会場限定メニューも楽しめる。"
"2018-11-08 17:06","天丼てんや、「ほっけの干物天」「ずわい蟹」などが楽しめる「ご馳走天丼」を11月15日から発売","天丼てんやは、11月15日から季節限定メニューとして、「ご馳走天丼」を発売する。 同商品は、初登場となる「ほっけの干物天」に加えて「ずわい蟹」も楽しめる商品。ほっけは、北海道紋別漁港水揚げのもの(加工..."
"2018-11-08 17:01","ハマの定番おやつ 鎌倉の隠れた名店「3時のおやつ工房」","おとぎ話に出てくるようなメルヘンチックな外観が目を引くスイーツ店「3時のおやつ工房」。北海道の新鮮なバターやカルピス社の高級生クリームなど厳選した食材を使用したスイーツの数々は、シンプルだけど素材の味を十分に楽しめるのが特徴だ。また、保存料や添加物を使用せずフレッシュなものだけで作るので、近隣の幼稚園のおやつなども手掛けている。"
"2018-11-08 17:00","ブランド肉を旅のお供に! 九州の駅で買える肉 L0VE な駅弁","良質なブランド肉を口いっぱいに頬張る幸せ!肉をこれでもか、と盛り込んだ九州で買える駅弁3選をご紹介。ぎゅーぎゅーに詰まった肉弁当をさあ召し上がれ。"
"2018-11-08 13:23","ミスドからリアルな“ポケモン ドーナツ”が登場!","10月12日(金)、ミスタードーナツからリアルでキュートな「ミスド ポケモン ドーナツ」(各216円)が発売される!"
"2018-11-08 12:50","トーストしなくてもふわふわ&しっとり!“生”で食べたい専門店の高級食パン6選","ただいまブーム到来中の高級食パン。専門店の食パンはまずは生で食べるのが正解!1つのパンを極めた専門店のおすすめ高級食パンをご紹介。＜※情報は関西ウォーカー(2018年11月6日発売号)より＞"
"2018-11-08 12:01","キアヌ・リーブスも訪れた! 「元祖ピザトースト」は考えられない量のチーズが…","J-WAVEで放送中の番組『STEP ONE』(ナビゲーター:サッシャ・寺岡歩美)のワンコーナー「7-ELEVEN LUNCH HUNTER」。この週はとろ～り食感が癖になるチーズランチを紹介! 11..."
"2018-11-08 12:00","「BAKE CHEESE TART」「RINGO」「クロッカンシュー ザクザク」冬の新商品が続々登場!","■ BAKE「ロイヤルミルクティーチーズタルト」"
"2018-11-08 12:00","大分の人気イタリアンがおくる異色の「和風カレー」!大葉と梅はカレーに合うのか?","大分県と言えば、皆さんは何を想像しますか?「別府の地獄めぐり」や「 湯布院」などの温泉と いったところでしょうか?実は、大分県は 全国屈指の“大葉”の生産地 なんだそうです! ご存知でしたか?筆者は、..."
"2018-11-08 12:00","横浜駅～みなとみらい周辺で今、絶対行くべきチーズ料理の人気店","11月11日は「チーズの日」。肌寒くなってくると食べたくなる、とろ～りアツアツの「チーズ」! とろとろのラクレットやチーズフォンデュなど、近ごろチーズが主役の料理がブームを呼んでいる。"
"2018-11-08 11:00","【開催中】「代々木VILLAGEオクトーバーナイトビア」で、秋の深まりを音楽と!","代々木VILLAGE by kurkku内のcode kurkku / MUSIC BARにて、「代々木VILLAGEオクトーバーナイトビア」が開催中。秋の心地よさをより一層深める、大人のビアイベント..."
"2018-11-08 07:40","福島で味わえる「鯛ラーメン」の新鋭3選! ふわりと山椒が効く担々麺に、香ばしいほぐし身も","2～3年ほど前からブームになっている鯛ダシのラーメン。福島県で17年以降にオープンした店の中から、鯛ラーメンが自慢の店を紹介する。〈※情報は発売中の「ラーメンWalker福島2019」より〉"
"2018-11-08 05:04","どうしてあんな普通の女が…?誰もが惚れるモテ男を射止めた“中の上の女”の正体とは","美人は不美人より、生涯で3億円の得をする。容姿にコンプレックスを抱いていた美咲麗華は、大学時代に学年一のモテ男・平塚勇太に恋をし、あっさり失恋したことである決意を抱く。-“美しさ”を金で買い、人生を変..."
"2018-11-08 05:02","「可愛いから大丈夫だよ」の殺し文句でダイエットの邪魔をする、“フレネミー女”の常套手段とは","世の中には、なぜか“女に嫌われる女”というものが存在する。女がその女の本性に気づいても、男は決して気づかない。それどころか男ウケは抜群に良かったりするのだ。そんな、女に嫌われる女―。あなたの周りにもい..."
"2018-11-08 05:01","六本木で今、話題沸騰中!少量小皿な高級中華は、ここぞのデートにぴったりでした!","六本木…。東京の夜遊び最先端のエリアでありながら、グルマンたちが集まる美食の街でもある。そんな六本木に、またしても艶やかで、本格的な中華が誕生した。驚きに満ちた中華料理を少しずつたくさん食べられるとあ..."
"2018-11-08 05:00","赤坂の会員制倶楽部で、ディナー予約を特別受付中!旬の白トリュフやフォアグラを味わい尽くそう!","東京には、選ばれた人のみが入ることを許される空間がある。赤坂の「NEW CITY CLUB OF TOKYO」もまた、そんな会員限定の倶楽部の一つだ。通常であれば会員でなければ入館できないところだが、..."
"2018-11-07 21:38","女性におすすめ!辛さ控えめなクリーミー担々麺を東海エリアで食べたい!!","担々麺の発祥は中国四川省で、本場では汁なしが一般的なスタイル。我々が慣れ親しんでいる汁ありタイプの担々麺は、日本で誕生したものだという。もともとは中国料理店における麺メニューの一つであった担々麺だが、近年は専門店が続々オープン。ゴマとラー油がベースになっているのはどの店も共通だが、素材へのこだわりやトッピングのアレンジによって、それぞれの店独自の担々麺を生み出している。"
"2018-11-07 20:30","ラーメン激戦区の名古屋・栄でいま食べたい絶品ラーメン5選!!","ラーメンの激戦区・栄には、数々の人気ラーメン店が軒を連ねる。そんななか今回は、栄を訪れた時に食べてほしいラーメンを、編集部の独断と偏見により5つ厳選して紹介!話題の店を中心にセレクトしたので、とくとご覧あれ!!"
"2018-11-07 20:11","連日完売の幻のチーズケーキが、東海エリアに再上陸!“究極にシンプル”なおいしさを体感せよ!","11月7日(水)から13日(火)までの7日間限定で、洋菓子ブランド「銀のぶどう」の代表商品「チーズケーキ かご盛り 白らら(しらら)」(1080円)のポップアップストアが「ジェイアール名古屋タカシマヤ」(名古屋市中村区)にオープンする。"
"2018-11-07 18:00","人気ベーカリー集結で大盛況!阪神百貨店「パンワールド」ヒットの裏側","阪神梅田本店の「パンワールド」は、京阪神を中心に、人気店のパンが期間限定で登場するセレクトショップ。マイベストを探すのが楽しい「食パンセレクトショップ」と、バラエティに富んだ個性派パンにも会える6つの「ベーカリーイベント」で大ヒット!そんなパンワールドのキーマンに聞いたヒットの裏側を公開!＜※情報は関西ウォーカー(2018年11月6日発売号)より＞"
"2018-11-07 18:00","沖縄「ザ・ナハテラス」に秋のパンとスイーツが期間限定で登場中","沖縄・那覇市のホテル「ザ・ナハテラス」では、11月30日(金)まで、季節のデザートとベーカリーを販売中だ。"
"2018-11-07 17:30","ラーメン界の“新世代”が贈る「ネオ豚骨」がおいしい、愛知・三重のラーメン店4選!","数あるジャンルのなかでも、特に高い人気を誇る豚骨ラーメン。ここでは、最近話題を集めている、“新世代”の店が届ける豚骨ラーメンをご紹介!正統派からアレンジ派まで、アプローチはさまざま。確立されたジャンルだからこそ、店主のチャレンジと工夫が光っている。"
"2018-11-07 17:00","食べておいしい!撮ってよし!器もカワイイ九州の駅弁","ユニークなパッケージでかわいく仕上げた駅弁はおいしいだけでなく、見栄えもいい。食べたあとの器は自分へのおみやげに !"
"2018-11-07 16:00","【時代はここまで進化した】質問に答えるだけでビールをチョイスしてくれるサービス始動","「クラフトビールを飲んでみたいけど、どの種類を選んだらいいかわからない……。」そんな人にビッグニュース!いくつかの質問に答えるだけでAIがおすすめのビールを教えてくれる、最先端のサービスが始動します。..."
"2018-11-07 14:30","＜福岡うどん愛＞もちもち感がたまらない!長時間熟成で麺の個性を発揮する「うどん満月 陣原駅前店」","JR陣原駅前に構える「うどん満月 陣原駅前店」は、「豊前裏打会」の加盟店。程よいコシがあり、透け感のある細麺と、奥深いダシ、それらを掛け合わせた多彩なアレンジメニューが人気だ。"
"2018-11-07 12:40","人気ブーランジェリーや専門店のマフィンが登場!阪神百貨店ベーカリーイベント","阪神梅田本店のパンフロア「パンワールド」は、6つのベーカリーイベントとドリンクコーナーで構成され、1週間ごとに店が入れ替わる。総菜パンをメインに、菓子パンやサンドイッチ、厨房併設のコーナーもあり幅広くパンをそろえている。そんなパンワールドの11月7日(水)～13日(火)のラインナップをご紹介!＜※情報は関西ウォーカー(2018年11月6日発売号)より＞"
"2018-11-07 12:00","“神戸ビーフ”に並ぶ実力!? 和牛のルーツ・但馬牛がたっぷり入った「神戸カレー」","黒毛和牛のなかでも、トップクラスの位置づけである“神戸ビーフ”。(以下、“神戸牛”と表記)『Currytion(カレーション)』でも、“ 銀座の名店が監修したカレー ”や、“ TVで紹介されたもの ..."
"2018-11-07 12:00","女子会にぴったり!かわいい店内で地元の旬野菜が食べ放題の八百屋カフェ SANNOMIYA","居酒屋ならぬ“IZACAFE(イザカフェ)”をテーマに、タピオカドリンクなどのカフェメニューや、地元野菜を使った料理が豊富にそろう「八百屋カフェ SANNOMIYA」。鉄製のフライパンを使った、見た目もかわいいスキレット料理がおすすめ。＜※情報は関西ウォーカー(2018年10月23日発売号)より＞"
